urn:cts:latinLit:phi0959.phi008:4.7.9	di faciant ut saepe tua sit epistula dextra
urn:cts:latinLit:phi0959.phi008:4.7.10	scripta, sed e multis reddita nulla mihi.
urn:cts:latinLit:phi0959.phi008:4.7.11	quod precor, esse liquet. credam prius ora Medusae
urn:cts:latinLit:phi0959.phi008:4.7.12	Gorgonis anguineis  cincta fuisse comis,
urn:cts:latinLit:phi0959.phi008:4.7.13	esse canes utero sub virginis, esse Chimaeram,
urn:cts:latinLit:phi0959.phi008:4.7.14	a truce quae flammis separet angue leam.
urn:cts:latinLit:phi0959.phi008:4.7.15	quadrupedesque hominis  cum pectore pectora iunctos,
urn:cts:latinLit:phi0959.phi008:4.7.16	tergeminumque virum tergeminumque canem,
urn:cts:latinLit:phi0959.phi008:4.7.17	Sphingaque et Harpyias serpentipedesque Gigantes,
urn:cts:latinLit:phi0959.phi008:4.7.18	centimanumque Gyan semibovemque virum.
urn:cts:latinLit:phi0959.phi008:4.7.19	haec ego cuncta prius, quam te, carissime, credam
urn:cts:latinLit:phi0959.phi008:4.7.20	mutatum curam deposuisse mei,
urn:cts:latinLit:phi0959.phi008:4.7.21	innumeri montes inter me teque viaeque
urn:cts:latinLit:phi0959.phi008:4.7.22	Summaque et campi nec freta pauca iacent,
urn:cts:latinLit:phi0959.phi008:4.7.23	mille potest causis a te quae littera saepe
urn:cts:latinLit:phi0959.phi008:4.7.24	missa sit in nostras rara venire manus;
urn:cts:latinLit:phi0959.phi008:4.7.25	mille tamen causas scribendo vince frequenter,
urn:cts:latinLit:phi0959.phi008:4.7.26	excusem ne te semper, amice, mihi.

urn:cts:latinLit:phi0959.phi008:4.8.1	Iam mea cycneas imitantur tempora plumas,
urn:cts:latinLit:phi0959.phi008:4.8.2	inficit et nigras alba senecta comas,
urn:cts:latinLit:phi0959.phi008:4.8.3	iam subeunt anni fragiles et inertior aetas,
urn:cts:latinLit:phi0959.phi008:4.8.4	iamque parum firmo me mihi ferre grave est.
urn:cts:latinLit:phi0959.phi008:4.8.5	nunc erat, ut posito deberem fine laborum
urn:cts:latinLit:phi0959.phi008:4.8.6	vivere, me nullo  sollicitante metu,
urn:cts:latinLit:phi0959.phi008:4.8.7	quaeque meae semper placuerunt otia menti
urn:cts:latinLit:phi0959.phi008:4.8.8	carpere et in studiis molliter esse meis,
urn:cts:latinLit:phi0959.phi008:4.8.9	et parvam celebrare domum veteresque Penates
urn:cts:latinLit:phi0959.phi008:4.8.10	et quae nunc domino rura paterna carent,
urn:cts:latinLit:phi0959.phi008:4.8.11	inque sinu dominae carisque sodalibus inque
urn:cts:latinLit:phi0959.phi008:4.8.12	securus patria consenuisse mea.
urn:cts:latinLit:phi0959.phi008:4.8.13	haec mea sic quondam peragi speraverat aetas:
urn:cts:latinLit:phi0959.phi008:4.8.14	hos ego sic annos ponere dignus eram.
urn:cts:latinLit:phi0959.phi008:4.8.15	non ita dis visum est, qui me terraque marique
urn:cts:latinLit:phi0959.phi008:4.8.16	actum  Sarmaticis exposuere locis.
urn:cts:latinLit:phi0959.phi008:4.8.17	in cava ducuntur quassae navalia puppes,
urn:cts:latinLit:phi0959.phi008:4.8.18	ne temere in mediis dissoluantur aquis.
urn:cts:latinLit:phi0959.phi008:4.8.19	ne cadat et multas palmas inhonestet adeptus,
urn:cts:latinLit:phi0959.phi008:4.8.20	languidus in pratis gramina carpit equus,
urn:cts:latinLit:phi0959.phi008:4.8.21	miles ubi emeritis non est satis utilis annis,
urn:cts:latinLit:phi0959.phi008:4.8.22	ponit ad antiquos, quae tulit, arma Lares,
urn:cts:latinLit:phi0959.phi008:4.8.23	sic igitur, tarda vires minuente senecta,
urn:cts:latinLit:phi0959.phi008:4.8.24	me quoque donari iam rude tempus erat.
urn:cts:latinLit:phi0959.phi008:4.8.25	tempus erat nec me peregrinum ducere caelum,
urn:cts:latinLit:phi0959.phi008:4.8.26	nec siccam Getico fonte levare sitim,
urn:cts:latinLit:phi0959.phi008:4.8.27	sed modo, quos habui, vacuos secedere in hortos,
urn:cts:latinLit:phi0959.phi008:4.8.28	nunc hominum visu rursus et urbe frui.
urn:cts:latinLit:phi0959.phi008:4.8.29	sic animo quondam non divinante futura
urn:cts:latinLit:phi0959.phi008:4.8.30	optabam placide vivere posse senex.
urn:cts:latinLit:phi0959.phi008:4.8.31	fata repugnarunt, quae, cum mihi tempora prima
urn:cts:latinLit:phi0959.phi008:4.8.32	mollia praebuerint, posteriora gravant.
urn:cts:latinLit:phi0959.phi008:4.8.33	iamque decem lustris omni sine labe peractis,
urn:cts:latinLit:phi0959.phi008:4.8.34	parte premor vitae deteriore meae,
urn:cts:latinLit:phi0959.phi008:4.8.35	nec procul a metis, quas paene tenere videbar,
urn:cts:latinLit:phi0959.phi008:4.8.36	curriculo gravis est facta ruina meo.
urn:cts:latinLit:phi0959.phi008:4.8.37	ergo illum demens in me saevire coegi,
urn:cts:latinLit:phi0959.phi008:4.8.38	mitius inmensus quo nihil orbis habet?
urn:cts:latinLit:phi0959.phi008:4.8.39	ipsaque delictis victa est clementia nostris,
urn:cts:latinLit:phi0959.phi008:4.8.40	nec tamen errori vita negata meo est?
urn:cts:latinLit:phi0959.phi008:4.8.41	vita procul patria peragenda sub axe Boreo,
urn:cts:latinLit:phi0959.phi008:4.8.42	qua maris Euxini terra sinistra iacet.
urn:cts:latinLit:phi0959.phi008:4.8.43	hoc mihi si Delphi  Dodonaque diceret ipsa,
urn:cts:latinLit:phi0959.phi008:4.8.44	esse videretur vanus uterque locus.
urn:cts:latinLit:phi0959.phi008:4.8.45	nil adeo validum est, adamas licet alliget illud,
urn:cts:latinLit:phi0959.phi008:4.8.46	ut maneat rapido firmius igne Iovis;
urn:cts:latinLit:phi0959.phi008:4.8.47	nil ita sublime est supraque pericula tendit
urn:cts:latinLit:phi0959.phi008:4.8.48	non sit ut inferius suppositumque deo.
urn:cts:latinLit:phi0959.phi008:4.8.49	nam quamquam vitio pars est contracta malorum,
urn:cts:latinLit:phi0959.phi008:4.8.50	plus tamen exitii numinis ira dedit.
urn:cts:latinLit:phi0959.phi008:4.8.51	at vos admoniti nostris quoque casibus este,
urn:cts:latinLit:phi0959.phi008:4.8.52	aequantem superos emeruisse virum.

urn:cts:latinLit:phi0959.phi008:4.9.1	Si licet et pateris, nomen facinusque tacebo,
urn:cts:latinLit:phi0959.phi008:4.9.2	et tua Lethaeis acta dabuntur aquis,
urn:cts:latinLit:phi0959.phi008:4.9.3	nostraque vincetur lacrimis clementia  seris,
urn:cts:latinLit:phi0959.phi008:4.9.4	fac modo te pateat paenituisse tui;
urn:cts:latinLit:phi0959.phi008:4.9.5	fac modo te damnes cupiasque eradere vitae
urn:cts:latinLit:phi0959.phi008:4.9.6	tempora, si possis, Tisiphonea tuae.
urn:cts:latinLit:phi0959.phi008:4.9.7	sin minus, et flagrant odio tua pectora nostro,
urn:cts:latinLit:phi0959.phi008:4.9.8	induet infelix arma coacta dolor,
urn:cts:latinLit:phi0959.phi008:4.9.9	sim licet extremum, sicut sum, missus in orbem,
urn:cts:latinLit:phi0959.phi008:4.9.10	nostra suas istinc  porriget ira manus,
urn:cts:latinLit:phi0959.phi008:4.9.11	omnia, si nescis, Caesar mihi iura reliquit,
urn:cts:latinLit:phi0959.phi008:4.9.12	et sola est patria poena carere mea.
urn:cts:latinLit:phi0959.phi008:4.9.13	et patriam, modo sit sospes, speramus ab illo:
urn:cts:latinLit:phi0959.phi008:4.9.14	saepe Iovis telo quercus adusta viret.
urn:cts:latinLit:phi0959.phi008:4.9.15	denique vindictae si sit mihi nulla facultas,
urn:cts:latinLit:phi0959.phi008:4.9.16	Pierides vires et sua tela dabunt,
urn:cts:latinLit:phi0959.phi008:4.9.17	quod Scythicis habitem longe summotus in oris,
urn:cts:latinLit:phi0959.phi008:4.9.18	siccaque sint oculis proxima signa meis,
urn:cts:latinLit:phi0959.phi008:4.9.19	nostra per inmensas ibunt praeconia gentes,
urn:cts:latinLit:phi0959.phi008:4.9.20	quodque querar notum qua patet orbis erit.
urn:cts:latinLit:phi0959.phi008:4.9.21	ibit ad occasum quicquid dicemus ab ortu,
urn:cts:latinLit:phi0959.phi008:4.9.22	testis et Hesperiae vocis Eous erit.
urn:cts:latinLit:phi0959.phi008:4.9.23	trans ego tellurem, trans altas audiar undas,
urn:cts:latinLit:phi0959.phi008:4.9.24	et gemitus vox est magna futura mei,
urn:cts:latinLit:phi0959.phi008:4.9.25	nec tua te sontem tantummodo saecula norint .
urn:cts:latinLit:phi0959.phi008:4.9.26	perpetuae crimen posteritatis eris.
urn:cts:latinLit:phi0959.phi008:4.9.27	iam feror in pugnas et nondum cornua sumpsi,
urn:cts:latinLit:phi0959.phi008:4.9.28	nec mihi sumendi causa sit ulla velim.
urn:cts:latinLit:phi0959.phi008:4.9.29	Circus adhuc cessat; spargit iam torvus  harenam
urn:cts:latinLit:phi0959.phi008:4.9.30	taurus et infesto iam pede pulsat humum.
urn:cts:latinLit:phi0959.phi008:4.9.31	hoc quoque, quam volui, plus est. cane, Musa, receptus,
urn:cts:latinLit:phi0959.phi008:4.9.32	dum licet huic nomen dissimulare suum.

urn:cts:latinLit:phi0959.phi008:4.10.1	Ille ego qui fuerim, tenerorum lusor amorum,
urn:cts:latinLit:phi0959.phi008:4.10.2	quem legis, ut noris, accipe posteritas.
urn:cts:latinLit:phi0959.phi008:4.10.3	Sulmo mihi patria est, gelidis uberrimus undis,
urn:cts:latinLit:phi0959.phi008:4.10.4	milia qui novies distat ab urbe decem.
urn:cts:latinLit:phi0959.phi008:4.10.5	editus hic ego sum, nec non, ut tempora noris,
urn:cts:latinLit:phi0959.phi008:4.10.6	cum cecidit fato consul uterque pari
urn:cts:latinLit:phi0959.phi008:4.10.7	si quid id est, usque a proavis  vetus ordinis heres
urn:cts:latinLit:phi0959.phi008:4.10.8	non modo fortunae munere factus eques,
urn:cts:latinLit:phi0959.phi008:4.10.9	nec stirps prima fui; genito sum fratre creatus,
urn:cts:latinLit:phi0959.phi008:4.10.10	qui tribus ante quater mensibus ortus erat.
urn:cts:latinLit:phi0959.phi008:4.10.11	Lucifer amborum natalibus affuit idem:
urn:cts:latinLit:phi0959.phi008:4.10.12	una celebrata est per duo liba dies;
urn:cts:latinLit:phi0959.phi008:4.10.13	haec est armiferae  festis de quinque Minervae,
urn:cts:latinLit:phi0959.phi008:4.10.14	quae fieri pugna prima cruenta solet.
urn:cts:latinLit:phi0959.phi008:4.10.15	protinus excolimur teneri curaque parentis
urn:cts:latinLit:phi0959.phi008:4.10.16	imus ad insignes urbis ab arte viros.
urn:cts:latinLit:phi0959.phi008:4.10.17	frater ad eloquium viridi tendebat ab aevo,
urn:cts:latinLit:phi0959.phi008:4.10.18	fortia verbosi natus ad arma fori,
urn:cts:latinLit:phi0959.phi008:4.10.19	at mihi iam puero caelestia sacra placebant,
urn:cts:latinLit:phi0959.phi008:4.10.20	inque suum furtim Musa trahebat opus.
urn:cts:latinLit:phi0959.phi008:4.10.21	saepe pater dixit " studium quid inutile temptas :
urn:cts:latinLit:phi0959.phi008:4.10.22	Maeonides nullas ipse reliquit opes."
urn:cts:latinLit:phi0959.phi008:4.10.23	motus eram dictis, totoque Helicone relicto
urn:cts:latinLit:phi0959.phi008:4.10.24	scribere temptabam  verba soluta modis.
urn:cts:latinLit:phi0959.phi008:4.10.25	sponte sua carmen numeros veniebat ad aptos,
urn:cts:latinLit:phi0959.phi008:4.10.26	et quod temptabam scribere  versus erat.
urn:cts:latinLit:phi0959.phi008:4.10.27	interea tacito passu labentibus annis
urn:cts:latinLit:phi0959.phi008:4.10.28	liberior fratri sumpta mihique toga est,
urn:cts:latinLit:phi0959.phi008:4.10.29	induiturque umeris  cum lato purpura clavo,
urn:cts:latinLit:phi0959.phi008:4.10.30	et studium nobis, quod fuit ante, manet.
urn:cts:latinLit:phi0959.phi008:4.10.31	iamque decem vitae frater geminaverat annos,
urn:cts:latinLit:phi0959.phi008:4.10.32	cum perit, et coepi parte carere mei.
urn:cts:latinLit:phi0959.phi008:4.10.33	cepimus et tenerae primos aetatis honores,
urn:cts:latinLit:phi0959.phi008:4.10.34	eque  viris quondam pars tribus una fui.
urn:cts:latinLit:phi0959.phi008:4.10.35	curia restabat . clavi mensura coacta est,
urn:cts:latinLit:phi0959.phi008:4.10.36	maius erat nostris viribus illud onus.
urn:cts:latinLit:phi0959.phi008:4.10.37	nec patiens corpus, nec mens fuit apta labori,
urn:cts:latinLit:phi0959.phi008:4.10.38	sollicitaeque fugax ambitionis eram,
urn:cts:latinLit:phi0959.phi008:4.10.39	et petere Aoniae suadebant tuta sorores
urn:cts:latinLit:phi0959.phi008:4.10.40	otia, iudicio semper amata meo.
urn:cts:latinLit:phi0959.phi008:4.10.41	temporis illius colui fovique potas,
urn:cts:latinLit:phi0959.phi008:4.10.42	quotque aderant vates, rebar adesse deos.
urn:cts:latinLit:phi0959.phi008:4.10.43	saepe suas volucres legit mihi grandior aevo,
urn:cts:latinLit:phi0959.phi008:4.10.44	quaeque nocet  serpens, quae iuvat  herba. Macer.
urn:cts:latinLit:phi0959.phi008:4.10.45	saepe suos solitus recitare Propertius ignes,
urn:cts:latinLit:phi0959.phi008:4.10.46	iure sodalicii, quo  mihi iunctus erat.
urn:cts:latinLit:phi0959.phi008:4.10.47	Ponticus heroo, Bassus quoque clarus iambis
urn:cts:latinLit:phi0959.phi008:4.10.48	dulcia convictus membra fuere mei.
urn:cts:latinLit:phi0959.phi008:4.10.49	et tenuit nostras numerosus Horatius aures;
urn:cts:latinLit:phi0959.phi008:4.10.50	dum ferit Ausonia carmina culta lyra.
urn:cts:latinLit:phi0959.phi008:4.10.51	Vergilium vidi tantum : nec avara Tibullo
urn:cts:latinLit:phi0959.phi008:4.10.52	tempus amicitiae fata dedere meae.
urn:cts:latinLit:phi0959.phi008:4.10.53	successor fuit hic tibi, Galle, Propertius illi;
urn:cts:latinLit:phi0959.phi008:4.10.54	quartus ab his sene temporis ipse fui.
urn:cts:latinLit:phi0959.phi008:4.10.55	utque ego maiores, sic me coluere minores,
urn:cts:latinLit:phi0959.phi008:4.10.56	notaque non tarde facta Thalia mea est.
urn:cts:latinLit:phi0959.phi008:4.10.57	carmina cum primum populo iuvenalia legi,
urn:cts:latinLit:phi0959.phi008:4.10.58	barba resecta mihi bisve semelve fuit.
urn:cts:latinLit:phi0959.phi008:4.10.59	moverat ingenium totam cantata per urbem
urn:cts:latinLit:phi0959.phi008:4.10.60	nomine non vero dicta Corinna mihi.
urn:cts:latinLit:phi0959.phi008:4.10.61	multa quidem scripsi, sed, quae vitiosa putavi,
urn:cts:latinLit:phi0959.phi008:4.10.62	emendaturis ignibus ipse dedi.
urn:cts:latinLit:phi0959.phi008:4.10.63	tunc quoque, cum fugerem, quaedam placitura cremavi,
urn:cts:latinLit:phi0959.phi008:4.10.64	iratus studio carminibusque meis.
urn:cts:latinLit:phi0959.phi008:4.10.65	molle Cupidineis nec inexpugnabile telis
urn:cts:latinLit:phi0959.phi008:4.10.66	cor mihi, quodque levis causa moveret, erat.
urn:cts:latinLit:phi0959.phi008:4.10.67	cum tamen hic essem minimoque accenderer igni,
urn:cts:latinLit:phi0959.phi008:4.10.68	nomine sub nostro fabula nulla fuit.
urn:cts:latinLit:phi0959.phi008:4.10.69	paene mihi puero nec digna nec utilis uxor
urn:cts:latinLit:phi0959.phi008:4.10.70	est data, quae tempus per breve nupta fuit.
urn:cts:latinLit:phi0959.phi008:4.10.71	illi successit, quamvis sine crimine coniunx,
urn:cts:latinLit:phi0959.phi008:4.10.72	non tamen in nostro firma futura toro.
urn:cts:latinLit:phi0959.phi008:4.10.73	ultima, quae mecum seros permansit in annos;
urn:cts:latinLit:phi0959.phi008:4.10.74	sustinuit coniunx exulis esse viri.
urn:cts:latinLit:phi0959.phi008:4.10.75	filia me mea bis prima fecunda iuventa,
urn:cts:latinLit:phi0959.phi008:4.10.76	sed non ex uno coniuge, fecit avum.
urn:cts:latinLit:phi0959.phi008:4.10.77	et iam complerat genitor sua fata novemque
urn:cts:latinLit:phi0959.phi008:4.10.78	addiderat lustris altera lustra novem.
urn:cts:latinLit:phi0959.phi008:4.10.79	non aliter flevi, quam me fleturus ademptum
urn:cts:latinLit:phi0959.phi008:4.10.80	ille fuit. Matri  proxima busta tuli.
urn:cts:latinLit:phi0959.phi008:4.10.81	felices ambo tempestiveque sepulti,
urn:cts:latinLit:phi0959.phi008:4.10.82	ante diem poenae quod periere
urn:cts:latinLit:phi0959.phi008:4.10.83	meae! me quoque felicem, quod non viventibus illis
urn:cts:latinLit:phi0959.phi008:4.10.84	sum miser, et de me quod doluere nihil!
urn:cts:latinLit:phi0959.phi008:4.10.85	si tamen extinctis aliquid nisi nomina restat,
urn:cts:latinLit:phi0959.phi008:4.10.86	et gracilis structas effugit umbra rogos,
urn:cts:latinLit:phi0959.phi008:4.10.87	fama, parentales, si vos mea contigit, umbrae,
urn:cts:latinLit:phi0959.phi008:4.10.88	et sunt in Stygio crimina nostra foro,
urn:cts:latinLit:phi0959.phi008:4.10.89	scite, precor, causam (nec vos mihi fallere fas est)
urn:cts:latinLit:phi0959.phi008:4.10.90	errorem iussae, non scelus, esse fugae.
urn:cts:latinLit:phi0959.phi008:4.10.91	Manibus hoc satis est: ad vos, studiosa, revertor,
urn:cts:latinLit:phi0959.phi008:4.10.92	pectora, quae vitae quaeritis acta meae.
urn:cts:latinLit:phi0959.phi008:4.10.93	iam mihi canities pulsis melioribus annis
urn:cts:latinLit:phi0959.phi008:4.10.94	venerat, antiquas miscueratque comas,
urn:cts:latinLit:phi0959.phi008:4.10.95	postque meos ortus Pisaea vinctus oliva
urn:cts:latinLit:phi0959.phi008:4.10.96	abstulerat deciens praemia victor eques,
urn:cts:latinLit:phi0959.phi008:4.10.97	cum maris Euxini positos ad laeva Tomitas
urn:cts:latinLit:phi0959.phi008:4.10.98	quaerere me laesi principis ira iubet.
urn:cts:latinLit:phi0959.phi008:4.10.99	causa meae cunctis nimium quoque nota ruinae
urn:cts:latinLit:phi0959.phi008:4.10.100	indicio non est testificanda meo.
urn:cts:latinLit:phi0959.phi008:4.10.101	quid referam comitumque nefas famulosque nocentes?
urn:cts:latinLit:phi0959.phi008:4.10.102	Ipsa  multa tuli non leviora fuga.
urn:cts:latinLit:phi0959.phi008:4.10.103	indignata malis mens est succumbere seque
urn:cts:latinLit:phi0959.phi008:4.10.104	praestitit invictam viribus usa suis;
urn:cts:latinLit:phi0959.phi008:4.10.105	oblitusque mei ductaeque per otia vitae
urn:cts:latinLit:phi0959.phi008:4.10.106	insolita cepi temporis arma manu;
urn:cts:latinLit:phi0959.phi008:4.10.107	totque tuli terra casus pelagoque quot inter
urn:cts:latinLit:phi0959.phi008:4.10.108	occultum stellae conspicuumque polum.
urn:cts:latinLit:phi0959.phi008:4.10.109	tacta mihi tandem longis erroribus acto
urn:cts:latinLit:phi0959.phi008:4.10.110	iuncta pharetratis Sarmatis ora Getis.
urn:cts:latinLit:phi0959.phi008:4.10.111	hic ego, finitimis quamvis circumsoner armis,
urn:cts:latinLit:phi0959.phi008:4.10.112	tristia, quo possum, carmine fata levo.
urn:cts:latinLit:phi0959.phi008:4.10.113	quod quamvis nemo est, cuius referatur ad aures,
urn:cts:latinLit:phi0959.phi008:4.10.114	sic tamen absumo decipioque diem.
urn:cts:latinLit:phi0959.phi008:4.10.115	ergo quod vivo duosque laboribus obsto,
urn:cts:latinLit:phi0959.phi008:4.10.116	nec me sollicitae taedia lucis habent,
urn:cts:latinLit:phi0959.phi008:4.10.117	gratia. Musa, tibi: nam tu solacia praebes,
urn:cts:latinLit:phi0959.phi008:4.10.118	tu curae requies, tu medicina venis.
urn:cts:latinLit:phi0959.phi008:4.10.119	tu dux et comes es, tu nos abducis ab Histro,
urn:cts:latinLit:phi0959.phi008:4.10.120	in medioque mihi das Helicone locum;
urn:cts:latinLit:phi0959.phi008:4.10.121	tu mihi, quod rarum est, vivo sublime dedisti
urn:cts:latinLit:phi0959.phi008:4.10.122	nomen, ab exequiis quod dare fama solet,
urn:cts:latinLit:phi0959.phi008:4.10.123	nec, qui detractat praesentia, Livor iniquo
urn:cts:latinLit:phi0959.phi008:4.10.124	ullum de nostris dente momordit opus.
urn:cts:latinLit:phi0959.phi008:4.10.125	nam tulerint magnos cum saecula nostra poetas,
urn:cts:latinLit:phi0959.phi008:4.10.126	non fuit ingenio fama maligna meo,
urn:cts:latinLit:phi0959.phi008:4.10.127	cumque ego praeponam multos mihi, non minor illis
urn:cts:latinLit:phi0959.phi008:4.10.128	dicor et in toto plurimus orbe legor.
urn:cts:latinLit:phi0959.phi008:4.10.129	si quid habent igitur vatum praesagia veri,
urn:cts:latinLit:phi0959.phi008:4.10.130	protinus ut moriar, non ero, terra, tuus.
urn:cts:latinLit:phi0959.phi008:4.10.131	sive favore tuli, sive hanc ego carmine famam,
urn:cts:latinLit:phi0959.phi008:4.10.132	iure tibi grates, candide lector, ago.

urn:cts:latinLit:phi0959.phi008:5.1.1	Hunc quoque de Getico, nostri studiose, libellum
urn:cts:latinLit:phi0959.phi008:5.1.2	litore praemissis quattuor adde meis.
urn:cts:latinLit:phi0959.phi008:5.1.3	hic quoque talis erit, qualis fortuna poetae:
urn:cts:latinLit:phi0959.phi008:5.1.4	invenies toto carmine dulce nihil.
urn:cts:latinLit:phi0959.phi008:5.1.5	flebilis ut noster status est, ita flebile carmen,
urn:cts:latinLit:phi0959.phi008:5.1.6	materiae scripto conveniente suae.
urn:cts:latinLit:phi0959.phi008:5.1.7	integer et laetus  laeta et iuvenalia lusi:
urn:cts:latinLit:phi0959.phi008:5.1.8	illa tamen nunc me composuisse piget,
urn:cts:latinLit:phi0959.phi008:5.1.9	ut cecidi, subiti perago praeconia casus,
urn:cts:latinLit:phi0959.phi008:5.1.10	sumque argumenti conditor ipse mei.
urn:cts:latinLit:phi0959.phi008:5.1.11	utque iacens ripa deflere Caystrius ales
urn:cts:latinLit:phi0959.phi008:5.1.12	dicitur ore suam deficiente necem,
urn:cts:latinLit:phi0959.phi008:5.1.13	sic ego, Sarmaticas longe proiectus in oras,
urn:cts:latinLit:phi0959.phi008:5.1.14	efficio tacitum ne mihi funus eat.
urn:cts:latinLit:phi0959.phi008:5.1.15	delicias siquis lascivaque carmina quaerit,
urn:cts:latinLit:phi0959.phi008:5.1.16	praemoneo, non est  scripta quod ista legat,
urn:cts:latinLit:phi0959.phi008:5.1.17	aptior huic Gallus blandique Propertius oris,
urn:cts:latinLit:phi0959.phi008:5.1.18	aptior, ingenium come, Tibullus erit.
urn:cts:latinLit:phi0959.phi008:5.1.19	atque utinam numero non nos  essemus in isto!
urn:cts:latinLit:phi0959.phi008:5.1.20	ei mihi, cur umquam Musa iocata  mea est?
urn:cts:latinLit:phi0959.phi008:5.1.21	sed dedimus poenas, Scythicique in finibus Histri
urn:cts:latinLit:phi0959.phi008:5.1.22	ille pharetrati lusor Amoris abest,
urn:cts:latinLit:phi0959.phi008:5.1.23	quod superest, animos  ad publica carmina flexi,
urn:cts:latinLit:phi0959.phi008:5.1.24	et memores iussi nominis esse mei.
urn:cts:latinLit:phi0959.phi008:5.1.25	 si tamen e vobis aliquis tam multa requiret,
urn:cts:latinLit:phi0959.phi008:5.1.26	unde dolenda Canam, multa dolenda tuli.
urn:cts:latinLit:phi0959.phi008:5.1.27	non haec ingenio, non haec componimus arte:
urn:cts:latinLit:phi0959.phi008:5.1.28	materia est propriis ingeniosa malis,
urn:cts:latinLit:phi0959.phi008:5.1.29	et quota fortunae pars est in carmine nostrae?
urn:cts:latinLit:phi0959.phi008:5.1.30	felix, qui patitur quae numerare potest!
urn:cts:latinLit:phi0959.phi008:5.1.31	quot frutices silvae, quot flavas Thybris harenas,
urn:cts:latinLit:phi0959.phi008:5.1.32	mollia quot Martis gramina campus habet,
urn:cts:latinLit:phi0959.phi008:5.1.33	tot mala pertulimus, quorum medicina quiesque
urn:cts:latinLit:phi0959.phi008:5.1.34	nulla nisi in studio est Pieridumque mora.
urn:cts:latinLit:phi0959.phi008:5.1.35	"quis tibi, Naso, modus lacrimosi carminis?" inquis
urn:cts:latinLit:phi0959.phi008:5.1.36	idem, fortunae qui modus huius erit.
urn:cts:latinLit:phi0959.phi008:5.1.37	quod querar, illa mihi pleno de fonte ministrat,
urn:cts:latinLit:phi0959.phi008:5.1.38	nec mea sunt, fati verba sed ista mei.
urn:cts:latinLit:phi0959.phi008:5.1.39	at mihi si cara patriam cum coniuge reddas,
urn:cts:latinLit:phi0959.phi008:5.1.40	sint vultus hilares, simque quod ante fui.
urn:cts:latinLit:phi0959.phi008:5.1.41	lenior invicti si sit mihi Caesaris ira,
urn:cts:latinLit:phi0959.phi008:5.1.42	carmina laetitiae iam tibi plena dabo.
urn:cts:latinLit:phi0959.phi008:5.1.43	nec tamen ut lusit, rursus mea littera ludet;
urn:cts:latinLit:phi0959.phi008:5.1.44	sit semel illa ioco luxuriata meo.
urn:cts:latinLit:phi0959.phi008:5.1.45	quod probet ipse, canam, poenae modo parte levata
urn:cts:latinLit:phi0959.phi008:5.1.46	barbariam rigidos effugiamque Getas.
urn:cts:latinLit:phi0959.phi008:5.1.47	interea nostri quid agant, nisi triste, libelli?
urn:cts:latinLit:phi0959.phi008:5.1.48	tibia funeribus convenit ista meis.
urn:cts:latinLit:phi0959.phi008:5.1.49	"at poteras" inquis "melius mala ferre silendo,
urn:cts:latinLit:phi0959.phi008:5.1.50	et tacitus casus dissimulare tuos."
urn:cts:latinLit:phi0959.phi008:5.1.51	exigis ut nulli gemitus tormenta sequantur,
urn:cts:latinLit:phi0959.phi008:5.1.52	acceptaque gravi vulnere flere vetas?
urn:cts:latinLit:phi0959.phi008:5.1.53	ipse Perilleo Phalaris permisit in aere
urn:cts:latinLit:phi0959.phi008:5.1.54	edere mugitus et bovis ore queri.
urn:cts:latinLit:phi0959.phi008:5.1.55	cum Priami lacrimis offensus non sit Achilles,
urn:cts:latinLit:phi0959.phi008:5.1.56	tu fletus inhibes, durior hoste, meos?
urn:cts:latinLit:phi0959.phi008:5.1.57	cum faceret Nioben orbam Latonia proles,
urn:cts:latinLit:phi0959.phi008:5.1.58	non tamen et  siccas iussit habere genas.
urn:cts:latinLit:phi0959.phi008:5.1.59	est aliquid, fatale malum per verba levare .
urn:cts:latinLit:phi0959.phi008:5.1.60	hoc quendam Procnen Halcyonenque facit.
urn:cts:latinLit:phi0959.phi008:5.1.61	hoc erat, in gelido quare Poeantius antro
urn:cts:latinLit:phi0959.phi008:5.1.62	voce fatigaret Lemnia saxa sua.
urn:cts:latinLit:phi0959.phi008:5.1.63	strangulat inclusus dolor atque exaestuat  intus,
urn:cts:latinLit:phi0959.phi008:5.1.64	cogitur et vires multiplicare suas.
urn:cts:latinLit:phi0959.phi008:5.1.65	da veniam potius, vel totos tolle libellos,
urn:cts:latinLit:phi0959.phi008:5.1.66	si mihi quod prodest hoc  tibi, lector, obest,
urn:cts:latinLit:phi0959.phi008:5.1.67	sed neque obesse potest, ulli nec scripta fuerunt
urn:cts:latinLit:phi0959.phi008:5.1.68	nostra nisi auctori perniciosa suo.
urn:cts:latinLit:phi0959.phi008:5.1.69	"at mala sunt. lateor. quis te mala sumere cogit?
urn:cts:latinLit:phi0959.phi008:5.1.70	aut quis deceptum ponere sumpta vetat?
urn:cts:latinLit:phi0959.phi008:5.1.71	ipse nec emendo,  sed ut hic deducta legantur;
urn:cts:latinLit:phi0959.phi008:5.1.72	non sunt illa suo barbariora loco.
urn:cts:latinLit:phi0959.phi008:5.1.73	nec me Roma suis debet conferre poetis :
urn:cts:latinLit:phi0959.phi008:5.1.74	inter Sauromatas ingeniosus eram.
urn:cts:latinLit:phi0959.phi008:5.1.75	denique nulla mihi captatur gloria, quaeque
urn:cts:latinLit:phi0959.phi008:5.1.76	ingeniis stimulos subdere fama solet.
urn:cts:latinLit:phi0959.phi008:5.1.77	nolumus assiduis animum tabescere curis,
urn:cts:latinLit:phi0959.phi008:5.1.78	quae tamen inrumpunt quoque vetantur eunt.
urn:cts:latinLit:phi0959.phi008:5.1.79	cur scribam, docui, cur mittam, quaeritis, isto ?
urn:cts:latinLit:phi0959.phi008:5.1.80	vobiscum cupio quolibet esse modo.

urn:cts:latinLit:phi0959.phi008:5.2.1	Ecquid ubi e Ponto nova venit epistula, palles,
urn:cts:latinLit:phi0959.phi008:5.2.2	et tibi sollicita solvitur illa manu?
urn:cts:latinLit:phi0959.phi008:5.2.3	pone metum, valeo; corpusque, quod ante laborum
urn:cts:latinLit:phi0959.phi008:5.2.4	inpatiens nobis invalidumque fuit,
urn:cts:latinLit:phi0959.phi008:5.2.5	sufficit, atque ipso vexatum induruit usu.
