urn:cts:latinLit:phi0959.phi008:2.1.221	non ea te moles Romani nominis urguet,
urn:cts:latinLit:phi0959.phi008:2.1.222	inque tuis umeris tam leve fertur onus,
urn:cts:latinLit:phi0959.phi008:2.1.223	lusibus ut possis advertere numen ineptis,
urn:cts:latinLit:phi0959.phi008:2.1.224	excutiasque oculis otia nostra tuis.
urn:cts:latinLit:phi0959.phi008:2.1.225	nunc tibi Pannonia est, nunc Illyris ora domanda,
urn:cts:latinLit:phi0959.phi008:2.1.226	Raeticanunc praebent Thraciaque arma metum,
urn:cts:latinLit:phi0959.phi008:2.1.227	nunc petit Armenius pacem, nunc porrigit arcus
urn:cts:latinLit:phi0959.phi008:2.1.228	Parthus eques timida captaque signa manu,
urn:cts:latinLit:phi0959.phi008:2.1.229	nunc te prole tua iuvenem Germania sentit,
urn:cts:latinLit:phi0959.phi008:2.1.230	bellaque pro magno Caesare Caesar obit;
urn:cts:latinLit:phi0959.phi008:2.1.231	denique, ut in tanto, quantum non extitit umquam,
urn:cts:latinLit:phi0959.phi008:2.1.232	corpore pars nulla est, quae labet, imperii.
urn:cts:latinLit:phi0959.phi008:2.1.233	urbs quoque te et legum lassat tutela tuarum
urn:cts:latinLit:phi0959.phi008:2.1.234	et morum, similes quos cupis esse tuis.
urn:cts:latinLit:phi0959.phi008:2.1.235	nec  tibi contingunt, quae gentibus otia praestas,
urn:cts:latinLit:phi0959.phi008:2.1.236	bellaque cum multis inrequieta geris,
urn:cts:latinLit:phi0959.phi008:2.1.237	mirer in hoc igitur tantarum pondere rerum
urn:cts:latinLit:phi0959.phi008:2.1.238	te numquam nostros evoluisse iocos?
urn:cts:latinLit:phi0959.phi008:2.1.239	at si, quod mallem, vacuum tibi forte  fuisset,
urn:cts:latinLit:phi0959.phi008:2.1.240	nullum legisses crimen in Arte mea.
urn:cts:latinLit:phi0959.phi008:2.1.241	illa quidem fateor frontis non esse severae
urn:cts:latinLit:phi0959.phi008:2.1.242	scripta, nec a tanto principe digna legi:
urn:cts:latinLit:phi0959.phi008:2.1.243	non tamen idcirco legum contraria iussis
urn:cts:latinLit:phi0959.phi008:2.1.244	sunt ea Romanas erudiuntque nurus.
urn:cts:latinLit:phi0959.phi008:2.1.245	neve, quibus scribam, possis dubitare, libellos,
urn:cts:latinLit:phi0959.phi008:2.1.246	quattuor hos versus e tribus unus habet :
urn:cts:latinLit:phi0959.phi008:2.1.247	este procul, vittae tenues, insigne pudoris,
urn:cts:latinLit:phi0959.phi008:2.1.248	quaeque tegis medios instita longa pedes!
urn:cts:latinLit:phi0959.phi008:2.1.249	nil nisi legitimum concessitque furta canemus,
urn:cts:latinLit:phi0959.phi008:2.1.250	inque meo nullum carmine crimen erit.
urn:cts:latinLit:phi0959.phi008:2.1.251	ecquid ab hac omnes rigide summovimus Arte,
urn:cts:latinLit:phi0959.phi008:2.1.252	quas stola contingi vittaque sumpta vetat?
urn:cts:latinLit:phi0959.phi008:2.1.253	at matrona potest alienis artibus uti, quodque
urn:cts:latinLit:phi0959.phi008:2.1.254	quoque trahat, quamvis non doceatur, habet.
urn:cts:latinLit:phi0959.phi008:2.1.255	nil igitur matrona legat, quia carmine ab omni
urn:cts:latinLit:phi0959.phi008:2.1.256	ad delinquendum doctior esse potest.
urn:cts:latinLit:phi0959.phi008:2.1.257	quodcumque attigerit, siqua est studiosa sinistri,
urn:cts:latinLit:phi0959.phi008:2.1.258	ad vitium mores instruet inde suos.
urn:cts:latinLit:phi0959.phi008:2.1.259	sumpserit Annales - nihil est hirsutius illis -
urn:cts:latinLit:phi0959.phi008:2.1.260	facta sit unde parens Ilia, nempe leget,
urn:cts:latinLit:phi0959.phi008:2.1.261	sumpserit Aeneadum genetrix ubi prima, requiret,
urn:cts:latinLit:phi0959.phi008:2.1.262	Aeneadum genetrix unde sit alma Venus.
urn:cts:latinLit:phi0959.phi008:2.1.263	persequar inferius, modo si licet ordine ferri,
urn:cts:latinLit:phi0959.phi008:2.1.264	posse nocere animis carminis omne genus.
urn:cts:latinLit:phi0959.phi008:2.1.265	non tamen idcirco crimen liber omnis habebit :
urn:cts:latinLit:phi0959.phi008:2.1.266	nil prodest, quod non laedere possit idem.
urn:cts:latinLit:phi0959.phi008:2.1.267	igne quid utilius? siquis tamen urere tecta
urn:cts:latinLit:phi0959.phi008:2.1.268	comparat, audaces instruit igne manus.
urn:cts:latinLit:phi0959.phi008:2.1.269	eripit interdum, modo dat medicina salutem,
urn:cts:latinLit:phi0959.phi008:2.1.270	quaeque iuvet, monstrat, quaeque sit herba nocens.
urn:cts:latinLit:phi0959.phi008:2.1.271	et latro et cautus praecingitur ense viator;
urn:cts:latinLit:phi0959.phi008:2.1.272	ille sed insidias, hic sibi portat opem.
urn:cts:latinLit:phi0959.phi008:2.1.273	discitur innocuas ut agat facundia causas;
urn:cts:latinLit:phi0959.phi008:2.1.274	protegit haec sontes, inmeritosque premit.
urn:cts:latinLit:phi0959.phi008:2.1.275	sic igitur carmen, recta si mente legatur,
urn:cts:latinLit:phi0959.phi008:2.1.276	constabit nulli posse nocere meum.
urn:cts:latinLit:phi0959.phi008:2.1.277	" at quasdam vitio." quicumque hoc concipit, errat,
urn:cts:latinLit:phi0959.phi008:2.1.278	et nimium scriptis arrogat ille meis.
urn:cts:latinLit:phi0959.phi008:2.1.279	ut tamen hoc fatear, ludi quoque semina praebent
urn:cts:latinLit:phi0959.phi008:2.1.280	nequitiae: tolli tota theatra iube!
urn:cts:latinLit:phi0959.phi008:2.1.281	peccandi causam multis quam  saepe dederunt.
urn:cts:latinLit:phi0959.phi008:2.1.282	Martia cum durum sternit harena solum!
urn:cts:latinLit:phi0959.phi008:2.1.283	tollatur Circus! non tuta licentia Circi est.
urn:cts:latinLit:phi0959.phi008:2.1.284	hic sedet ignoto iuncta puella viro.
urn:cts:latinLit:phi0959.phi008:2.1.285	cum quaedam spatientur in hoc,  ut amator eodem
urn:cts:latinLit:phi0959.phi008:2.1.286	conveniat, quare porticus ulla patet .
urn:cts:latinLit:phi0959.phi008:2.1.287	quis locus est templis augustior? haec quoque vitet,
urn:cts:latinLit:phi0959.phi008:2.1.288	in culpam siqua est ingeniosa suam.
urn:cts:latinLit:phi0959.phi008:2.1.289	cum steterit Iovis aede, Iovis succurret in aede
urn:cts:latinLit:phi0959.phi008:2.1.290	quam multas matres fecerit ille deus.
urn:cts:latinLit:phi0959.phi008:2.1.291	proxima adoranti Iunonis templa subibit,
urn:cts:latinLit:phi0959.phi008:2.1.292	paelicibus multis hanc doluisse deam.
urn:cts:latinLit:phi0959.phi008:2.1.293	Pallade conspecta, natum de crimine virgo
urn:cts:latinLit:phi0959.phi008:2.1.294	sustulerit quare, quaeret, Erichthonium.
urn:cts:latinLit:phi0959.phi008:2.1.295	venerit in magni templum, tua munera, Martis,
urn:cts:latinLit:phi0959.phi008:2.1.296	stat Venus Ultori iuncta, vir  ante fores.
urn:cts:latinLit:phi0959.phi008:2.1.297	Isidis aede sedens, cur hanc Saturnia, quaeret,
urn:cts:latinLit:phi0959.phi008:2.1.298	egerit Ionio Bosphorioque mari.
urn:cts:latinLit:phi0959.phi008:2.1.299	in Venerem Anchises, in Lunam Latmius heros,
urn:cts:latinLit:phi0959.phi008:2.1.300	in Cererem Iasion, qui referatur, erit.
urn:cts:latinLit:phi0959.phi008:2.1.301	omnia perversae possunt corrumpere mentes;
urn:cts:latinLit:phi0959.phi008:2.1.302	stant tamen illa suis omnia tuta locis,
urn:cts:latinLit:phi0959.phi008:2.1.303	et procul a scripta solis meretricibus Arte
urn:cts:latinLit:phi0959.phi008:2.1.304	summovet ingenuas pagina prima manus.
urn:cts:latinLit:phi0959.phi008:2.1.305	 quaecumque erupit, qua non sinit ire sacerdos,
urn:cts:latinLit:phi0959.phi008:2.1.306	protinus huic  dempti criminis ipsa rea est.
urn:cts:latinLit:phi0959.phi008:2.1.307	nec tamen est facinus versus evolvere mollis;
urn:cts:latinLit:phi0959.phi008:2.1.308	multa licet castae non facienda legant.
urn:cts:latinLit:phi0959.phi008:2.1.309	saepe supercilii nudas matrona severi
urn:cts:latinLit:phi0959.phi008:2.1.310	et veneris stantis ad genus omne videt,
urn:cts:latinLit:phi0959.phi008:2.1.311	corpora Vestales oculi meretricia cernunt,
urn:cts:latinLit:phi0959.phi008:2.1.312	nec domino poenae res ea causa fuit.
urn:cts:latinLit:phi0959.phi008:2.1.313	at cur in nostra nimia est lascivia Musa,
urn:cts:latinLit:phi0959.phi008:2.1.314	curve meus cuiquam suadet amare liber?
urn:cts:latinLit:phi0959.phi008:2.1.315	nil nisi peccatum manifestaque culpa fatenda est:
urn:cts:latinLit:phi0959.phi008:2.1.316	paenitet ingenii iudiciique mei.
urn:cts:latinLit:phi0959.phi008:2.1.317	cur non Argolicis potius quae concidit armis
urn:cts:latinLit:phi0959.phi008:2.1.318	vexata est iterum carmine Troia meo?
urn:cts:latinLit:phi0959.phi008:2.1.319	cur tacui Thebas et vulnera mutua fratrum,
urn:cts:latinLit:phi0959.phi008:2.1.320	et septem portas, sub duce quamque suo?
urn:cts:latinLit:phi0959.phi008:2.1.321	nec mihi materiam bellatrix Roma negabat,
urn:cts:latinLit:phi0959.phi008:2.1.322	et pius est patriae facta referre labor.
urn:cts:latinLit:phi0959.phi008:2.1.323	denique cum meritis impleveris omnia, Caesar,
urn:cts:latinLit:phi0959.phi008:2.1.324	pars mihi de multis una canenda fuit,
urn:cts:latinLit:phi0959.phi008:2.1.325	utque trahunt oculos radiantia lumina solis,
urn:cts:latinLit:phi0959.phi008:2.1.326	traxissent animum sic tua facta meum.
urn:cts:latinLit:phi0959.phi008:2.1.327	arguor iumento, tenuis mihi campus aratur;
urn:cts:latinLit:phi0959.phi008:2.1.328	illud erat magnae fertilitatis opus.
urn:cts:latinLit:phi0959.phi008:2.1.329	non ideo debet pelago se credere, siqua
urn:cts:latinLit:phi0959.phi008:2.1.330	audet in exiguo ludere cumba lacu.
urn:cts:latinLit:phi0959.phi008:2.1.331	forsan - et hoc dubitem - numeris levioribus aptus
urn:cts:latinLit:phi0959.phi008:2.1.332	sim satis, in parvos sufficiamque modos:
urn:cts:latinLit:phi0959.phi008:2.1.333	at si me iubeas domitos Iovis igne Gigantes
urn:cts:latinLit:phi0959.phi008:2.1.334	dicere, conantem debilitabit onus
urn:cts:latinLit:phi0959.phi008:2.1.335	divitis ingenii est immania Caesaris acta
urn:cts:latinLit:phi0959.phi008:2.1.336	condere, materia ne superetur opus.
urn:cts:latinLit:phi0959.phi008:2.1.337	et tamen ausus eram; sed detrectare videbar,
urn:cts:latinLit:phi0959.phi008:2.1.338	quodque nefas, damno viribus esse tuis.
urn:cts:latinLit:phi0959.phi008:2.1.339	ad leve rursus opus, iuvenalia carmina, veni,
urn:cts:latinLit:phi0959.phi008:2.1.340	et falso movi pectus amore meum.
urn:cts:latinLit:phi0959.phi008:2.1.341	non equidem vellem, sed me mea fata trahebant,
urn:cts:latinLit:phi0959.phi008:2.1.342	inque meas poenas ingeniosus eram.
urn:cts:latinLit:phi0959.phi008:2.1.343	ei mihi, quod didici! cur me docuere parentes
urn:cts:latinLit:phi0959.phi008:2.1.344	litteraque est oculos ulla morata meos?
urn:cts:latinLit:phi0959.phi008:2.1.345	haec tibi me invisum lascivia fecit, ob artes,
urn:cts:latinLit:phi0959.phi008:2.1.346	quis ratus es vetitos sollicitare toros.
urn:cts:latinLit:phi0959.phi008:2.1.347	sed neque me nuptae didicerunt furta magistro,
urn:cts:latinLit:phi0959.phi008:2.1.348	quodque parum novit, nemo docere potest,
urn:cts:latinLit:phi0959.phi008:2.1.349	sic ego delicias et mollia carmina feci,
urn:cts:latinLit:phi0959.phi008:2.1.350	strinxerit ut nomen fabula nulla meum.
urn:cts:latinLit:phi0959.phi008:2.1.351	nec quisquam est adeo media de plebe maritus,
urn:cts:latinLit:phi0959.phi008:2.1.352	ut dubius vitio sit pater ille meo,
urn:cts:latinLit:phi0959.phi008:2.1.353	crede mihi, distant mores a carmine nostro -
urn:cts:latinLit:phi0959.phi008:2.1.354	vita verecunda est, Musa iocosa mea -
urn:cts:latinLit:phi0959.phi008:2.1.355	magnaque pars mendax operum est et ficta meorum:
urn:cts:latinLit:phi0959.phi008:2.1.356	plus sibi permisit compositore suo.
urn:cts:latinLit:phi0959.phi008:2.1.357	nec liber indicium est animi, sed honesta voluntas
urn:cts:latinLit:phi0959.phi008:2.1.358	plurima mulcendis auribus apta ferens.
urn:cts:latinLit:phi0959.phi008:2.1.359	Accius esset atrox, conviva Terentius esset,
urn:cts:latinLit:phi0959.phi008:2.1.360	essent pugnaces qui fera bella canunt.
urn:cts:latinLit:phi0959.phi008:2.1.361	denique composui teneros non solus amores:
urn:cts:latinLit:phi0959.phi008:2.1.362	composito poenas solus amore dedi.
urn:cts:latinLit:phi0959.phi008:2.1.363	quid, nisi cum multo Venerem confundere vino
urn:cts:latinLit:phi0959.phi008:2.1.364	praecepit lyrici Teia Musa senis?
urn:cts:latinLit:phi0959.phi008:2.1.365	Lesbia quid docuit Sappho, nisi amare, puellas?
urn:cts:latinLit:phi0959.phi008:2.1.366	tuta tamen Sappho, tutus et ille fuit.
urn:cts:latinLit:phi0959.phi008:2.1.367	nec tibi, Battiade, nocuit, quod saepe legenti
urn:cts:latinLit:phi0959.phi008:2.1.368	delicias versu fassus es ipse tuas.
urn:cts:latinLit:phi0959.phi008:2.1.369	fabula iucundi nulla est sine amore Menandri,
urn:cts:latinLit:phi0959.phi008:2.1.370	et solet hic pueris virginibusque legi.
urn:cts:latinLit:phi0959.phi008:2.1.371	Ilias ipsa quid est aliud nisi adultera, de qua
urn:cts:latinLit:phi0959.phi008:2.1.372	inter amatorem pugna virumque fuit?
urn:cts:latinLit:phi0959.phi008:2.1.373	quid prius est illi flamma Briseidos, utque
urn:cts:latinLit:phi0959.phi008:2.1.374	fecerit iratos rapta puella duces?
urn:cts:latinLit:phi0959.phi008:2.1.375	aut quid Odyssea est nisi femina propter amorem,
urn:cts:latinLit:phi0959.phi008:2.1.376	dum vir abest, multis una petita procis?
urn:cts:latinLit:phi0959.phi008:2.1.377	quis nisi Maeonides, Venerem Martemque ligatos
urn:cts:latinLit:phi0959.phi008:2.1.378	narrat, in obsceno corpora prensa toro?.
urn:cts:latinLit:phi0959.phi008:2.1.379	unde nisi indicio magni sciremus Homeri
urn:cts:latinLit:phi0959.phi008:2.1.380	hospitis igne duas incaluisse- deas?
urn:cts:latinLit:phi0959.phi008:2.1.381	omne genus scripti gravitate tragoedia vinci .
urn:cts:latinLit:phi0959.phi008:2.1.382	haec quoque materiam semper amoris habet,
urn:cts:latinLit:phi0959.phi008:2.1.383	num quid  in Hippolyto, nisi caecae flamma novercae?
urn:cts:latinLit:phi0959.phi008:2.1.384	nobilis est Canace fratris amore sui.
urn:cts:latinLit:phi0959.phi008:2.1.385	quid? non Tantalides, agitante Cupidine currus,
urn:cts:latinLit:phi0959.phi008:2.1.386	Pisaeam Phrygiis vexit eburnus equis?
urn:cts:latinLit:phi0959.phi008:2.1.387	tingueret ut ferrum natorum sanguine mater,
urn:cts:latinLit:phi0959.phi008:2.1.388	concitus a laeso fecit amore dolor,
urn:cts:latinLit:phi0959.phi008:2.1.389	fecit amor subitas volucres cum paelice regem,
urn:cts:latinLit:phi0959.phi008:2.1.390	quaeque suum luget nunc quoque mater Ityn.
urn:cts:latinLit:phi0959.phi008:2.1.391	si non Aropen frater sceleratus amasset,
urn:cts:latinLit:phi0959.phi008:2.1.392	aversos Solis non legeremus equos.
urn:cts:latinLit:phi0959.phi008:2.1.393	impia nec tragicos tetigisset Scylla cothurnos,
urn:cts:latinLit:phi0959.phi008:2.1.394	ni patrium crinem desecuisset amor.
urn:cts:latinLit:phi0959.phi008:2.1.395	qui legis Electran et egentem mentis Oresten,
urn:cts:latinLit:phi0959.phi008:2.1.396	Aegisthi crimen Tyndaridosque legis.
urn:cts:latinLit:phi0959.phi008:2.1.397	nam quid de tetrico referam domitore Chimaerae,
urn:cts:latinLit:phi0959.phi008:2.1.398	quem leto fallax hospita paene dedit?
urn:cts:latinLit:phi0959.phi008:2.1.399	quid loquar Hermionen, quid te, Schoenea virgo,
urn:cts:latinLit:phi0959.phi008:2.1.400	teque, Mycenaeo Phoebas amata duci.
urn:cts:latinLit:phi0959.phi008:2.1.401	quid Danaen Danaesque nurum matremque Lyaei
urn:cts:latinLit:phi0959.phi008:2.1.402	Haemonaque et noctes cui coiere duae?
urn:cts:latinLit:phi0959.phi008:2.1.403	quid Peliae generum, quid Thesea, quique  Pelasgum
urn:cts:latinLit:phi0959.phi008:2.1.404	Iliacam tetigit de rate primus humum?
urn:cts:latinLit:phi0959.phi008:2.1.405	huc Iole Pyrrhique parens, huc Herculis uxor,
urn:cts:latinLit:phi0959.phi008:2.1.406	huc accedat Hylas Iliacusque puer.
urn:cts:latinLit:phi0959.phi008:2.1.407	tempore deficiar, tragicos si persequar ignes,
urn:cts:latinLit:phi0959.phi008:2.1.408	vixque meus capiet nomina nuda Uber.
urn:cts:latinLit:phi0959.phi008:2.1.409	est et in obscenos commixta  tragoedia risus,
urn:cts:latinLit:phi0959.phi008:2.1.410	multaque praeteriti verba pudoris habet;
urn:cts:latinLit:phi0959.phi008:2.1.411	nec nocet auctori, mollem qui fecit Achillem,
urn:cts:latinLit:phi0959.phi008:2.1.412	infregisse suis fortia facta modis,
urn:cts:latinLit:phi0959.phi008:2.1.413	iunxit Aristides Milesia crimina secum,
urn:cts:latinLit:phi0959.phi008:2.1.414	pulsus Aristides nec tamen urbe sua est.
urn:cts:latinLit:phi0959.phi008:2.1.415	nec qui descripsit corrumpi semina matrum,
urn:cts:latinLit:phi0959.phi008:2.1.416	Eubius, impurae conditor historiae,
urn:cts:latinLit:phi0959.phi008:2.1.417	nec qui composuit nuper Sybaritica, fugit,
urn:cts:latinLit:phi0959.phi008:2.1.418	nec qui concubitus non tacuere suos.
urn:cts:latinLit:phi0959.phi008:2.1.419	suntque ea doctorum monumentis mixta  virorum,
urn:cts:latinLit:phi0959.phi008:2.1.420	muneribusque ducum publica facta patent.
urn:cts:latinLit:phi0959.phi008:2.1.421	neve peregrinis tantum defendar ab armis,
urn:cts:latinLit:phi0959.phi008:2.1.422	et Romanus habet multa iocosa liber,
urn:cts:latinLit:phi0959.phi008:2.1.423	utque suo Martem cecinit gravis
urn:cts:latinLit:phi0959.phi008:2.1.424	Ennius ore - Ennius ingenio maximus, arte rudis -
urn:cts:latinLit:phi0959.phi008:2.1.425	explicat ut causas rapidi Lucretius ignis,
urn:cts:latinLit:phi0959.phi008:2.1.426	casurumque triplex vaticinatur opus,
urn:cts:latinLit:phi0959.phi008:2.1.427	sic sua lascivo cantata est saepe Catullo
urn:cts:latinLit:phi0959.phi008:2.1.428	femina, cui falsum Lesbia nomen erat;
urn:cts:latinLit:phi0959.phi008:2.1.429	nec contentus ea, multos vulgavit amores,
urn:cts:latinLit:phi0959.phi008:2.1.430	in quibus ipse suum fassus adulterium est.
urn:cts:latinLit:phi0959.phi008:2.1.431	par fuit exigui similisque licentia Calvi,
urn:cts:latinLit:phi0959.phi008:2.1.432	detexit variis qui sua furta  modis,
urn:cts:latinLit:phi0959.phi008:2.1.433	quid referam Ticidae, quid Memmi carmen, apud quos
urn:cts:latinLit:phi0959.phi008:2.1.434	rebus adest nomen nominibusque pudor?
urn:cts:latinLit:phi0959.phi008:2.1.435	Cinna quoque his comes est, Cinnaque procacior Anser,
urn:cts:latinLit:phi0959.phi008:2.1.436	et leve Cornifiei parque Catonis opus.
urn:cts:latinLit:phi0959.phi008:2.1.437	et quorum libris modo dissimulata Perillae,
urn:cts:latinLit:phi0959.phi008:2.1.438	nomine, nunc legitur dicta, Metelle, tuo.
urn:cts:latinLit:phi0959.phi008:2.1.439	is quoque, Phasiacas Argon qui duxit in undas,
urn:cts:latinLit:phi0959.phi008:2.1.440	 non potuit Veneris furta tacere suae.
urn:cts:latinLit:phi0959.phi008:2.1.441	nec minus Hortensi, nec sunt minus improba Servi
urn:cts:latinLit:phi0959.phi008:2.1.442	carmina, quis dubitet nomina Planta sequi?
urn:cts:latinLit:phi0959.phi008:2.1.443	vertit Aristiden Sisenna, nec obfuit illi
urn:cts:latinLit:phi0959.phi008:2.1.444	historiae turpis inseruisse iocos.
urn:cts:latinLit:phi0959.phi008:2.1.445	non fuit opprobrio celebrasse Lycorida Gallo,
urn:cts:latinLit:phi0959.phi008:2.1.446	sed linguam nimio non tenuisse mero.
urn:cts:latinLit:phi0959.phi008:2.1.447	credere iuranti durum putat esse Tibullus,
urn:cts:latinLit:phi0959.phi008:2.1.448	sic etiam de se quod neget illa viro.
urn:cts:latinLit:phi0959.phi008:2.1.449	fallere custodes idem  docuisse fatetur,
urn:cts:latinLit:phi0959.phi008:2.1.450	seque sua miserum nunc ait arte premi.
urn:cts:latinLit:phi0959.phi008:2.1.451	saepe, velut gemmam dominae signumve probaret,
urn:cts:latinLit:phi0959.phi008:2.1.452	per causam meminit se tetigisse manum;
urn:cts:latinLit:phi0959.phi008:2.1.453	utque refert, digitis saepe est nutuque locutus,
urn:cts:latinLit:phi0959.phi008:2.1.454	et tacitam mensae duxit in orbe notam
urn:cts:latinLit:phi0959.phi008:2.1.455	et quibus e sucis abeat de corpore livor,
urn:cts:latinLit:phi0959.phi008:2.1.456	impresso fieri qui solet ore, docet:
urn:cts:latinLit:phi0959.phi008:2.1.457	denique ab incauto nimium petit ille marito,
urn:cts:latinLit:phi0959.phi008:2.1.458	se quoque uti servet, peccet ut illa minus,
urn:cts:latinLit:phi0959.phi008:2.1.459	scit, cui latretur, cum solus obambulet, ipsas
urn:cts:latinLit:phi0959.phi008:2.1.460	cur  totiens clausas exercet ante fores,
urn:cts:latinLit:phi0959.phi008:2.1.461	multaque dat furti talis praecepta docetque
urn:cts:latinLit:phi0959.phi008:2.1.462	qua nuptae possint fallere ab arte viros,
urn:cts:latinLit:phi0959.phi008:2.1.463	non fuit hoc illi fraudi, legiturque Tibullus
urn:cts:latinLit:phi0959.phi008:2.1.464	et placet, et iam te principe notus erat.
urn:cts:latinLit:phi0959.phi008:2.1.465	invenies eadem blandi praecepta Properti:
urn:cts:latinLit:phi0959.phi008:2.1.466	destrictus minima nec tamen ille nota est.
urn:cts:latinLit:phi0959.phi008:2.1.467	his ego successi, quoniam praestantia candor
urn:cts:latinLit:phi0959.phi008:2.1.468	nomina vivorum dissimulare iubet,
urn:cts:latinLit:phi0959.phi008:2.1.469	non timui, fateor, ne, qua tot iere carinae,
urn:cts:latinLit:phi0959.phi008:2.1.470	naufraga servatis omnibus una foret.
urn:cts:latinLit:phi0959.phi008:2.1.471	sunt aliis scriptae, quibus alea luditur, artes: -
urn:cts:latinLit:phi0959.phi008:2.1.472	hoc est ad nostros non leve crimen avos -  -
urn:cts:latinLit:phi0959.phi008:2.1.473	quid valeant tali, quo possis plurima iactu
urn:cts:latinLit:phi0959.phi008:2.1.474	figere, damnosos effugiasque canes;
urn:cts:latinLit:phi0959.phi008:2.1.475	tessera quos habeat numeros, distante vocato
urn:cts:latinLit:phi0959.phi008:2.1.476	mittere quo deceat, quo dare missa modo;
urn:cts:latinLit:phi0959.phi008:2.1.477	discolor ut recto grassetur limite miles,
urn:cts:latinLit:phi0959.phi008:2.1.478	eum medius gemino calculus hoste perit,
urn:cts:latinLit:phi0959.phi008:2.1.479	ut bellare  sequens  sciat et revocare priorem,
urn:cts:latinLit:phi0959.phi008:2.1.480	nec tuto fugiens incomitatus eat,
urn:cts:latinLit:phi0959.phi008:2.1.481	parva sit ut ternis  instructa tabella lapillis,
urn:cts:latinLit:phi0959.phi008:2.1.482	in qua vicisse est continuasse suos,
urn:cts:latinLit:phi0959.phi008:2.1.483	quique alii lusus - neque enim nunc persequar omnes -
urn:cts:latinLit:phi0959.phi008:2.1.484	perdere, rem caram, tempora nostra solent.
urn:cts:latinLit:phi0959.phi008:2.1.485	ecce canit formas alius laetusque pilarum,
urn:cts:latinLit:phi0959.phi008:2.1.486	hic artem nandi praecipit, ille trochi.
urn:cts:latinLit:phi0959.phi008:2.1.487	composita est aliis fucandi cura coloris,
urn:cts:latinLit:phi0959.phi008:2.1.488	hic epulis leges hospitioque dedit;
urn:cts:latinLit:phi0959.phi008:2.1.489	alter humum, de qua fingantur pocula, monstrat,
urn:cts:latinLit:phi0959.phi008:2.1.490	quaeque, docet, liquido testa sit apta mero.
urn:cts:latinLit:phi0959.phi008:2.1.491	talia luduntur fumoso mense Decembri,
urn:cts:latinLit:phi0959.phi008:2.1.492	quae damno nulli composuisse fuit.
urn:cts:latinLit:phi0959.phi008:2.1.493	his ego deceptus non tristia carmina feci,
urn:cts:latinLit:phi0959.phi008:2.1.494	sed tristis nostros poena secuta iocos.
urn:cts:latinLit:phi0959.phi008:2.1.495	denique nec video tot de scribentibus unum,
urn:cts:latinLit:phi0959.phi008:2.1.496	quem sua perdiderit Musa; repertus ego.
urn:cts:latinLit:phi0959.phi008:2.1.497	quid, si scripsissem mimos obscena iocantes,
urn:cts:latinLit:phi0959.phi008:2.1.498	qui semper vetiti  crimen amoris habent,
urn:cts:latinLit:phi0959.phi008:2.1.499	in quibus assidue cultus procedit adulter,
urn:cts:latinLit:phi0959.phi008:2.1.500	verbaque dat stulto callida nupta viro?
urn:cts:latinLit:phi0959.phi008:2.1.501	nubilis hos virgo matronaque virque puerque
urn:cts:latinLit:phi0959.phi008:2.1.502	spectat, et ex magna parte senatus adest,
urn:cts:latinLit:phi0959.phi008:2.1.503	nec satis incestis temerari vocibus aures;
urn:cts:latinLit:phi0959.phi008:2.1.504	adsuescunt oculi multa pudenda pati;
urn:cts:latinLit:phi0959.phi008:2.1.505	cumque fefellit amans aliqua novitate maritum,
urn:cts:latinLit:phi0959.phi008:2.1.506	plauditur et magno palma favore datur; quodque
urn:cts:latinLit:phi0959.phi008:2.1.507	quoque minus prodest, scaena  est lucrosa poetae,
urn:cts:latinLit:phi0959.phi008:2.1.508	tantaque non parvo crimina praetor emit.
urn:cts:latinLit:phi0959.phi008:2.1.509	inspice ludorum sumptus, Auguste, tuorum:
urn:cts:latinLit:phi0959.phi008:2.1.510	empta tibi magno talia multa leges.
urn:cts:latinLit:phi0959.phi008:2.1.511	haec tu spectasti spectandaque saepe dedisti
urn:cts:latinLit:phi0959.phi008:2.1.512	maiestas adeo comis ubique tua est -
urn:cts:latinLit:phi0959.phi008:2.1.513	luminibusque tuis, totus quibus utitur orbis,
urn:cts:latinLit:phi0959.phi008:2.1.514	scaenica vidisti lentus adulteria.
urn:cts:latinLit:phi0959.phi008:2.1.515	scribere si fas est imitantes turpia mimos,
urn:cts:latinLit:phi0959.phi008:2.1.516	materiae minor est debita poena meae.
urn:cts:latinLit:phi0959.phi008:2.1.517	an genus hoc scripti faciunt sua pulpita tutum,
urn:cts:latinLit:phi0959.phi008:2.1.518	quodque licet, mimis scaena licere dedit?
urn:cts:latinLit:phi0959.phi008:2.1.519	et mea sunt populo saltata poemata saepe,
urn:cts:latinLit:phi0959.phi008:2.1.520	saepe oculos etiam detinuere tuos.
urn:cts:latinLit:phi0959.phi008:2.1.521	scilicet in domibus nostris  ut prisca virorum
urn:cts:latinLit:phi0959.phi008:2.1.522	artificis fulgent corpora picta manu,
urn:cts:latinLit:phi0959.phi008:2.1.523	sic quae concubitus varios venerisque figuras
urn:cts:latinLit:phi0959.phi008:2.1.524	exprimat, est aliquo parva tabella loco.
urn:cts:latinLit:phi0959.phi008:2.1.525	utque sedet vultu fassus Telamonius iram,
urn:cts:latinLit:phi0959.phi008:2.1.526	inque oculis facinus barbara mater habet,
urn:cts:latinLit:phi0959.phi008:2.1.527	sic madidos siccat digitis Venus uda capillos,
urn:cts:latinLit:phi0959.phi008:2.1.528	et modo maternis tecta videtur aquis,
urn:cts:latinLit:phi0959.phi008:2.1.529	bella sonant alii telis instructa eruditis,
urn:cts:latinLit:phi0959.phi008:2.1.530	parsque tui generis, pars tua facta canunt,
urn:cts:latinLit:phi0959.phi008:2.1.531	invida me spatio natura coercuit arto,
urn:cts:latinLit:phi0959.phi008:2.1.532	ingenio vires exiguasque dedit,
urn:cts:latinLit:phi0959.phi008:2.1.533	et tamen ille tuae felix Aeneidos auctor
urn:cts:latinLit:phi0959.phi008:2.1.534	contulit in Tyrios arma virumque toros,
urn:cts:latinLit:phi0959.phi008:2.1.535	nec legitur pars ulla magis de corpore toto,
urn:cts:latinLit:phi0959.phi008:2.1.536	quam non legitimo foedere iunctus amor.
