urn:cts:latinLit:phi0959.phi008:1.1.1	Parve - nec invideo - sine me, liber, ibis in urbem,
urn:cts:latinLit:phi0959.phi008:1.1.2	ei mihi, quod  domino non licet ire tuo!
urn:cts:latinLit:phi0959.phi008:1.1.3	vade, sed incultus, qualem decet exulis esse
urn:cts:latinLit:phi0959.phi008:1.1.4	infelix habitum temporis huius habe.
urn:cts:latinLit:phi0959.phi008:1.1.5	nec te purpureo velent vaccinia fuco -
urn:cts:latinLit:phi0959.phi008:1.1.6	non est conveniens luctibus ille color -
urn:cts:latinLit:phi0959.phi008:1.1.7	nec titulus minio, nec cedro charta notetur,
urn:cts:latinLit:phi0959.phi008:1.1.8	candida nec nigra cornua fronte geras.
urn:cts:latinLit:phi0959.phi008:1.1.9	felices ornent haec instrumenta libellos;
urn:cts:latinLit:phi0959.phi008:1.1.10	fortunae memorem te decet esse meae.
urn:cts:latinLit:phi0959.phi008:1.1.11	nec fragili geminae poliantur pumice frontes,
urn:cts:latinLit:phi0959.phi008:1.1.12	hirsutus sparsis ut videare comis,
urn:cts:latinLit:phi0959.phi008:1.1.13	neve liturarum pudeat; qui viderit illas,
urn:cts:latinLit:phi0959.phi008:1.1.14	de lacrimis factas sentiet  esse meis.
urn:cts:latinLit:phi0959.phi008:1.1.15	vade, liber, verbisque meis loca grata saluta:
urn:cts:latinLit:phi0959.phi008:1.1.16	contingam certe quo licet illa pede.
urn:cts:latinLit:phi0959.phi008:1.1.17	siquis, ut in populo, nostri non inmemor illi,
urn:cts:latinLit:phi0959.phi008:1.1.18	siquis, qui, quid agam, forte requirat, erit,
urn:cts:latinLit:phi0959.phi008:1.1.19	vivere me dices, salvum tamen esse negabis;
urn:cts:latinLit:phi0959.phi008:1.1.20	id quoque, quod vivam, munus habere dei.
urn:cts:latinLit:phi0959.phi008:1.1.21	atque ita tu tacitus - quaerenti plura legendus  -
urn:cts:latinLit:phi0959.phi008:1.1.22	ne, quae non opus est, forte loquare, cave!
urn:cts:latinLit:phi0959.phi008:1.1.23	protinus admonitus repetet mea crimina lector,
urn:cts:latinLit:phi0959.phi008:1.1.24	et peragar populi publicus ore reus.
urn:cts:latinLit:phi0959.phi008:1.1.25	tu cave defendas, quamvis mordebere dictis;
urn:cts:latinLit:phi0959.phi008:1.1.26	causa patrocinio non bona maior  erit.
urn:cts:latinLit:phi0959.phi008:1.1.27	invenies aliquem, qui me suspiret ademptum,
urn:cts:latinLit:phi0959.phi008:1.1.28	carmina nec siccis perlegat ista genis,
urn:cts:latinLit:phi0959.phi008:1.1.29	et tacitus secum, ne quis malus audiat, optet,
urn:cts:latinLit:phi0959.phi008:1.1.30	sit mea lenito Caesare poena levis.
urn:cts:latinLit:phi0959.phi008:1.1.31	nos quoque, quisquis erit, ne sit miser ille, precamur,
urn:cts:latinLit:phi0959.phi008:1.1.32	placatos miseris qui volet esse deos,
urn:cts:latinLit:phi0959.phi008:1.1.33	quaeque volet, rata sint, ablataque principis ira
urn:cts:latinLit:phi0959.phi008:1.1.34	sedibus in patriis det mihi posse mori.
urn:cts:latinLit:phi0959.phi008:1.1.35	ut peragas mandata, liber, culpabere forsan
urn:cts:latinLit:phi0959.phi008:1.1.36	ingeniique minor laude ferere mei.
urn:cts:latinLit:phi0959.phi008:1.1.37	iudicis officium est ut res, ita tempora rerum
urn:cts:latinLit:phi0959.phi008:1.1.38	quaerere, quaesito tempore tutus eris.
urn:cts:latinLit:phi0959.phi008:1.1.39	carmina proveniunt animo deducta sereno;
urn:cts:latinLit:phi0959.phi008:1.1.40	nubila sunt subitis tempora nostra malis,
urn:cts:latinLit:phi0959.phi008:1.1.41	carmina secessum scribentis et otia quaerunt;
urn:cts:latinLit:phi0959.phi008:1.1.42	me mare, me venti, me fera iactat hiems.
urn:cts:latinLit:phi0959.phi008:1.1.43	carminibus metus omnis obest ; perditus ensem
urn:cts:latinLit:phi0959.phi008:1.1.44	haesurum iugulo iam puto iamque meo.
urn:cts:latinLit:phi0959.phi008:1.1.45	haec quoque quod facio, iudex mirabitur aequus,
urn:cts:latinLit:phi0959.phi008:1.1.46	scriptaque cum venia qualiacumque leget.
urn:cts:latinLit:phi0959.phi008:1.1.47	da mihi Maeoniden et tot circumice  casus,
urn:cts:latinLit:phi0959.phi008:1.1.48	ingenium tantis excidet omne malis.
urn:cts:latinLit:phi0959.phi008:1.1.49	denique securus famae, liber, ire memento,
urn:cts:latinLit:phi0959.phi008:1.1.50	nec tibi sit lecto displicuisse pudor.
urn:cts:latinLit:phi0959.phi008:1.1.51	non ita se nobis praebet Fortuna secundam,
urn:cts:latinLit:phi0959.phi008:1.1.52	ut tibi sit ratio laudis habenda tuae.
urn:cts:latinLit:phi0959.phi008:1.1.53	donec eram sospes, tituli tangebar amore,
urn:cts:latinLit:phi0959.phi008:1.1.54	quaerendique mihi nominis ardor erat.
urn:cts:latinLit:phi0959.phi008:1.1.55	carmina nunc si non studiumque, quod obfuit, odi,
urn:cts:latinLit:phi0959.phi008:1.1.56	sit satis; ingenio sic fuga parta meo.
urn:cts:latinLit:phi0959.phi008:1.1.57	tu tamen i pro me, tu, cui licet, aspice Romam,
urn:cts:latinLit:phi0959.phi008:1.1.58	di facerent, possem nunc meus esse liber!
urn:cts:latinLit:phi0959.phi008:1.1.59	nec te, quod venias magnam peregrinus in urbem,
urn:cts:latinLit:phi0959.phi008:1.1.60	ignotum populo posse venire puta.
urn:cts:latinLit:phi0959.phi008:1.1.61	ut titulo careas, ipso noscere colore
urn:cts:latinLit:phi0959.phi008:1.1.62	dissimulare velis, te liquet esse meum,
urn:cts:latinLit:phi0959.phi008:1.1.63	clam tamen intrato, ne te mea carmina laedant;
urn:cts:latinLit:phi0959.phi008:1.1.64	non sunt ut quondam plena favoris erant.
urn:cts:latinLit:phi0959.phi008:1.1.65	siquis erit, qui te, quia sis meus, esse legendum
urn:cts:latinLit:phi0959.phi008:1.1.66	non putet, e gremio reiciatque suo,
urn:cts:latinLit:phi0959.phi008:1.1.67	"inspice " dic " titulum, non sum praeceptor amoris;
urn:cts:latinLit:phi0959.phi008:1.1.68	quas meruit, poenas iam dedit illud opus.
urn:cts:latinLit:phi0959.phi008:1.1.69	forsitan expectes, an in alta Palatia missum
urn:cts:latinLit:phi0959.phi008:1.1.70	scandere te iubeam Caesareamque domum.
urn:cts:latinLit:phi0959.phi008:1.1.71	ignoscant augusta mihi loca dique locorum!
urn:cts:latinLit:phi0959.phi008:1.1.72	venit in hoc illa fulmen ab arce caput.
urn:cts:latinLit:phi0959.phi008:1.1.73	esse quidem memini mitissima sedibus illis
urn:cts:latinLit:phi0959.phi008:1.1.74	numina, sed timeo qui nocuere deos.
urn:cts:latinLit:phi0959.phi008:1.1.75	terretur minimo pennae stridore columba,
urn:cts:latinLit:phi0959.phi008:1.1.76	unguibus, accipiter, saucia facta tuis.
urn:cts:latinLit:phi0959.phi008:1.1.77	nec procul a stabulis audet discedere, siqua
urn:cts:latinLit:phi0959.phi008:1.1.78	excussa est avidi dentibus agna lupi.
urn:cts:latinLit:phi0959.phi008:1.1.79	vitaret caelum Phaethon, si viveret, et quos
urn:cts:latinLit:phi0959.phi008:1.1.80	optarat stulte, tangere nollet equos.
urn:cts:latinLit:phi0959.phi008:1.1.81	me quoque, quae sensi, fateor Iovis arma timere :
urn:cts:latinLit:phi0959.phi008:1.1.82	me reor infesto, cum tonat, igne peti.
urn:cts:latinLit:phi0959.phi008:1.1.83	quicumque Argolica de classe Capherea fugit,
urn:cts:latinLit:phi0959.phi008:1.1.84	semper ab Euboicis vela retorsit  aquis;
urn:cts:latinLit:phi0959.phi008:1.1.85	et mea cumba semel vasta percussa procella
urn:cts:latinLit:phi0959.phi008:1.1.86	illum, quo laesa est, horret adire locum,
urn:cts:latinLit:phi0959.phi008:1.1.87	ergo cave, liber, et timida circumspice mente,
urn:cts:latinLit:phi0959.phi008:1.1.88	ut satis a media sit tibi plebe legi.
urn:cts:latinLit:phi0959.phi008:1.1.89	dum petit infirmis nimium sublimia pennis
urn:cts:latinLit:phi0959.phi008:1.1.90	Icarus, aequoreas nomine fecit aquas.
urn:cts:latinLit:phi0959.phi008:1.1.91	difficile est tamen hinc, remis utaris an aura,
urn:cts:latinLit:phi0959.phi008:1.1.92	dicere: consilium resque locusque dabunt,
urn:cts:latinLit:phi0959.phi008:1.1.93	si poteris vacuo tradi, si cuncta videbis
urn:cts:latinLit:phi0959.phi008:1.1.94	mitia, si vires fregerit ira suas,
urn:cts:latinLit:phi0959.phi008:1.1.95	siquis erit, qui te dubitantem et adire timentem
urn:cts:latinLit:phi0959.phi008:1.1.96	tradat, et ante tamen pauca loquatur, adi.
urn:cts:latinLit:phi0959.phi008:1.1.97	luce bona dominoque tuo felicior ipso
urn:cts:latinLit:phi0959.phi008:1.1.98	pervenias illuc et mala nostra leves.
urn:cts:latinLit:phi0959.phi008:1.1.99	namque ea vel nemo, vel qui mihi vulnera fecit
urn:cts:latinLit:phi0959.phi008:1.1.100	solus Achilleo tollere more potest.
urn:cts:latinLit:phi0959.phi008:1.1.101	tantum ne noceas, dum vis prodesse, videto -
urn:cts:latinLit:phi0959.phi008:1.1.102	nam spes est animi nostra timore minor -
urn:cts:latinLit:phi0959.phi008:1.1.103	quaeque quiescebat, ne mota resaeviat ira
urn:cts:latinLit:phi0959.phi008:1.1.104	et poenae tu sis altera causa, cave!
urn:cts:latinLit:phi0959.phi008:1.1.105	cum tamen in nostrum fueris penetrale receptus,
urn:cts:latinLit:phi0959.phi008:1.1.106	contigerisque tuam, scrinia curva, domum,
urn:cts:latinLit:phi0959.phi008:1.1.107	aspicies illic positos ex ordine fratres,
urn:cts:latinLit:phi0959.phi008:1.1.108	quos studium cunctos evigilavit idem.
urn:cts:latinLit:phi0959.phi008:1.1.109	cetera turba palam titulos ostendet apertos,
urn:cts:latinLit:phi0959.phi008:1.1.110	et sua detecta nomina fronte geret;
urn:cts:latinLit:phi0959.phi008:1.1.111	tres procul obscura latitantes parte videbis, -
urn:cts:latinLit:phi0959.phi008:1.1.112	sic quoque, quod nemo nescit, amare docent.
urn:cts:latinLit:phi0959.phi008:1.1.113	hos tu vel fugias, vel, si satis oris habebis,
urn:cts:latinLit:phi0959.phi008:1.1.114	Oedipodas facito Telegonosque voces.
urn:cts:latinLit:phi0959.phi008:1.1.115	deque tribus, moneo, si qua est tibi cura parentis,
urn:cts:latinLit:phi0959.phi008:1.1.116	ne quemquam, quamvis ipse docebit, ames.
urn:cts:latinLit:phi0959.phi008:1.1.117	sunt quoque mutatae, ter quinque volumina, formae,
urn:cts:latinLit:phi0959.phi008:1.1.118	nuper ab exequiis carmina rapta meis.
urn:cts:latinLit:phi0959.phi008:1.1.119	his mando dicas, inter mutata referri
urn:cts:latinLit:phi0959.phi008:1.1.120	fortunae vultum corpora posse meae.
urn:cts:latinLit:phi0959.phi008:1.1.121	namque ea dissimilis subito est effecta priori,
urn:cts:latinLit:phi0959.phi008:1.1.122	flendaque nunc, aliquo tempore laeta fuit.
urn:cts:latinLit:phi0959.phi008:1.1.123	plura quidem mandare tibi, si quaeris, habebam,
urn:cts:latinLit:phi0959.phi008:1.1.124	sed vereor tardae causa fuisse morae ;
urn:cts:latinLit:phi0959.phi008:1.1.125	et si quae subeunt, tecum, liber, omnia ferres,
urn:cts:latinLit:phi0959.phi008:1.1.126	sarcina laturo magna futurus eras.
urn:cts:latinLit:phi0959.phi008:1.1.127	longa via est, propera! nobis habitabitur orbis
urn:cts:latinLit:phi0959.phi008:1.1.128	ultimus, a terra terra remota mea.

urn:cts:latinLit:phi0959.phi008:1.2.1	Di maris et caeli - quid enim nisi vota supersunt? -
urn:cts:latinLit:phi0959.phi008:1.2.2	solvere quassatae parcite membra ratis,
urn:cts:latinLit:phi0959.phi008:1.2.3	neve, precor, magni subscribite Caesaris irae!
urn:cts:latinLit:phi0959.phi008:1.2.4	saepe premente deo fert deus alter opem.
urn:cts:latinLit:phi0959.phi008:1.2.5	Mulciber in Troiam, pro Troia stabat Apollo;
urn:cts:latinLit:phi0959.phi008:1.2.6	aequa Venus Teucris, Pallas iniqua fuit.
urn:cts:latinLit:phi0959.phi008:1.2.7	oderat Aenean propior Saturnia Turno;
urn:cts:latinLit:phi0959.phi008:1.2.8	ille tamen Veneris numine tutus erat.
urn:cts:latinLit:phi0959.phi008:1.2.9	saepe ferox cautum petiit Neptunus Ulixen;
urn:cts:latinLit:phi0959.phi008:1.2.10	eripuit patruo saepe Minerva suo.
urn:cts:latinLit:phi0959.phi008:1.2.11	et nobis aliquod, quamvis distamus ab illis,
urn:cts:latinLit:phi0959.phi008:1.2.12	quis vetat irato numen adesse deo?
urn:cts:latinLit:phi0959.phi008:1.2.13	verba miser frustra non proficientia perdo.
urn:cts:latinLit:phi0959.phi008:1.2.14	ipsa graves spargunt ora loquentis aquae,
urn:cts:latinLit:phi0959.phi008:1.2.15	terribilisque Notus iactat mea dicta, precesque
urn:cts:latinLit:phi0959.phi008:1.2.16	ad quos mittuntur, non sinit ire deos.
urn:cts:latinLit:phi0959.phi008:1.2.17	ergo idem venti, ne causa laedar in una,
urn:cts:latinLit:phi0959.phi008:1.2.18	velaque nescio quo votaque nostra ferunt,
urn:cts:latinLit:phi0959.phi008:1.2.19	me miserum, quanti montes volvuntur aquarum!
urn:cts:latinLit:phi0959.phi008:1.2.20	iam iam tacturos sidera summa putes,
urn:cts:latinLit:phi0959.phi008:1.2.21	quantae diducto subsidunt "aequore valles!
urn:cts:latinLit:phi0959.phi008:1.2.22	iam iam tacturas Tartara nigra putes,
urn:cts:latinLit:phi0959.phi008:1.2.23	quocumque aspicio, nihil est, nisi pontus et aer,
urn:cts:latinLit:phi0959.phi008:1.2.24	fluctibus hic tumidus, nubibus ille minax.
urn:cts:latinLit:phi0959.phi008:1.2.25	inter utrumque fremunt inmani murmure venti.
urn:cts:latinLit:phi0959.phi008:1.2.26	nescit, cui domino pareat, unda maris.
urn:cts:latinLit:phi0959.phi008:1.2.27	nam modo purpureo vires capit Eurus ab ortu,
urn:cts:latinLit:phi0959.phi008:1.2.28	nunc Zephyrus sero vespere missus adest,
urn:cts:latinLit:phi0959.phi008:1.2.29	nunc sicca gelidus Boreas bacchatur ab Arcto,
urn:cts:latinLit:phi0959.phi008:1.2.30	nunc Notus adversa proelia fronte gerit.
urn:cts:latinLit:phi0959.phi008:1.2.31	rector in incerto est nec quid fugiatve petatve
urn:cts:latinLit:phi0959.phi008:1.2.32	invenit: ambiguis ars stupet ipsa malis,
urn:cts:latinLit:phi0959.phi008:1.2.33	scilicet occidimus, nec spes est ulla salutis,
urn:cts:latinLit:phi0959.phi008:1.2.34	dumque loquor, vultus obruit unda meos.
urn:cts:latinLit:phi0959.phi008:1.2.35	opprimet hanc animam fluctus, frustraque precanti
urn:cts:latinLit:phi0959.phi008:1.2.36	ore necaturas accipiemus aquas,
urn:cts:latinLit:phi0959.phi008:1.2.37	at pia nil aliud quam me dolet exule coniunx:
urn:cts:latinLit:phi0959.phi008:1.2.38	hoc unum nostri scitque gemitque mali.
urn:cts:latinLit:phi0959.phi008:1.2.39	nescit in inmenso iactari corpora ponto,
urn:cts:latinLit:phi0959.phi008:1.2.40	nescit agi ventis, nescit adesse necem.
urn:cts:latinLit:phi0959.phi008:1.2.41	o bene, quod non sum mecum conscendere passus,
urn:cts:latinLit:phi0959.phi008:1.2.42	ne mihi mors misero bis patienda foret!
urn:cts:latinLit:phi0959.phi008:1.2.43	at nunc, ut peream, quoniam caret illa periclo,
urn:cts:latinLit:phi0959.phi008:1.2.44	dimidia certe parte superstes ero.
urn:cts:latinLit:phi0959.phi008:1.2.45	ei mihi, quam celeri micuerunt nubila flamma!
urn:cts:latinLit:phi0959.phi008:1.2.46	quantus ab aetherio personat axe fragor!
urn:cts:latinLit:phi0959.phi008:1.2.47	nec levius tabulae laterum feriuntur ab undis,
urn:cts:latinLit:phi0959.phi008:1.2.48	quam grave balistae moenia pulsat onus.
urn:cts:latinLit:phi0959.phi008:1.2.49	qui venit hic fluctus, fluctus supereminet omnes:
urn:cts:latinLit:phi0959.phi008:1.2.50	posterior nono est undecimoque prior.
urn:cts:latinLit:phi0959.phi008:1.2.51	nec letum timeo; genus est miserabile leti.
urn:cts:latinLit:phi0959.phi008:1.2.52	demite naufragium, mors mihi munus erit.
urn:cts:latinLit:phi0959.phi008:1.2.53	est aliquid, fatove suo ferrove  cadentem
urn:cts:latinLit:phi0959.phi008:1.2.54	in solida  moriens ponere corpus humo,
urn:cts:latinLit:phi0959.phi008:1.2.55	et mandare suis aliqua et  sperare sepulcrum
urn:cts:latinLit:phi0959.phi008:1.2.56	et non aequoreis piscibus esse cibum,
urn:cts:latinLit:phi0959.phi008:1.2.57	fingite me dignum tali nece, non ego solus
urn:cts:latinLit:phi0959.phi008:1.2.58	hic vehor. inmeritos cur mea poena trahit?
urn:cts:latinLit:phi0959.phi008:1.2.59	pro superi viridesque dei, quibus aequora curae,
urn:cts:latinLit:phi0959.phi008:1.2.60	utraque iam vestras sistite turba minas,
urn:cts:latinLit:phi0959.phi008:1.2.61	quamque dedit vitam mitissima Caesaris ira,
urn:cts:latinLit:phi0959.phi008:1.2.62	hanc sinite infelix in loca iussa feram,
urn:cts:latinLit:phi0959.phi008:1.2.63	si quantam  merui, poena me perdere vultis,
urn:cts:latinLit:phi0959.phi008:1.2.64	culpa mea est ipso iudice morte minor.
urn:cts:latinLit:phi0959.phi008:1.2.65	mittere me Stygias si iam voluisset in undas
urn:cts:latinLit:phi0959.phi008:1.2.66	Caesar, in hoc vestra non eguisset ope.
urn:cts:latinLit:phi0959.phi008:1.2.67	est illi nostri non invidiosa cruoris
urn:cts:latinLit:phi0959.phi008:1.2.68	copia; quodque dedit, cum volet, ipse feret,
urn:cts:latinLit:phi0959.phi008:1.2.69	vos modo, quos certe nullo, puto, crimine laesi,
urn:cts:latinLit:phi0959.phi008:1.2.70	contenti nostris iam, precor, este malis!
urn:cts:latinLit:phi0959.phi008:1.2.71	nec tamen, ut cuncti miserum servare velitis,
urn:cts:latinLit:phi0959.phi008:1.2.72	quod periit, salvum iam caput esse potest,
urn:cts:latinLit:phi0959.phi008:1.2.73	ut mare considat ventisque ferentibus utar,
urn:cts:latinLit:phi0959.phi008:1.2.74	ut mihi parcatis, non minus exul ero.
urn:cts:latinLit:phi0959.phi008:1.2.75	non ego divitias avidus sine fine parandi
urn:cts:latinLit:phi0959.phi008:1.2.76	latum mutandis mercibus aequor aro,
urn:cts:latinLit:phi0959.phi008:1.2.77	nec peto, quas quondam petii studiosus, Athenas,
urn:cts:latinLit:phi0959.phi008:1.2.78	oppida non Asiae, non loca visa prius,
urn:cts:latinLit:phi0959.phi008:1.2.79	non ut Alexandri claram delatus ad urbem
urn:cts:latinLit:phi0959.phi008:1.2.80	delicias videam, Nile iocose, tuas.
urn:cts:latinLit:phi0959.phi008:1.2.81	quod faciles  opto ventos, - quis credere posset ? -
urn:cts:latinLit:phi0959.phi008:1.2.82	Sarmatis est tellus, quam mea vela petunt,
urn:cts:latinLit:phi0959.phi008:1.2.83	obligor, ut tangam laevi fera litora Ponti;
urn:cts:latinLit:phi0959.phi008:1.2.84	quodque sit a patria tam  fuga tarda, queror.
urn:cts:latinLit:phi0959.phi008:1.2.85	nescio quo videam positos ut in orbe Tomitas,
urn:cts:latinLit:phi0959.phi008:1.2.86	exilem facio per mea vota viam.
urn:cts:latinLit:phi0959.phi008:1.2.87	seu me diligitis, tantos conpescite fluctus,
urn:cts:latinLit:phi0959.phi008:1.2.88	pronaque sint nostrae numina vestra rati;
urn:cts:latinLit:phi0959.phi008:1.2.89	seu magis odistis, iussae Ine advertite terrae:
urn:cts:latinLit:phi0959.phi008:1.2.90	supplicii pars est in regione mei.
urn:cts:latinLit:phi0959.phi008:1.2.91	ferte - quid hic facio? - rapidi mea corpora  venti!
urn:cts:latinLit:phi0959.phi008:1.2.92	Ausonios fines cur mea vela volunt?
urn:cts:latinLit:phi0959.phi008:1.2.93	noluit hoc Caesar, quid, quem fugat ille, tenetis?
urn:cts:latinLit:phi0959.phi008:1.2.94	aspiciat vultus Pontica terra meos.
urn:cts:latinLit:phi0959.phi008:1.2.95	et iubet et merui; nec, quae damnaverit ille,
urn:cts:latinLit:phi0959.phi008:1.2.96	crimina defendi fasque piumque puto.
urn:cts:latinLit:phi0959.phi008:1.2.97	si tamen acta deos numquam mortalia fallunt,
urn:cts:latinLit:phi0959.phi008:1.2.98	a culpa facinus scitis abesse mea.
urn:cts:latinLit:phi0959.phi008:1.2.99	immo ita si scitis, si me meus abstulit error,
urn:cts:latinLit:phi0959.phi008:1.2.100	stultaque mens nobis, non scelerata fuit,
urn:cts:latinLit:phi0959.phi008:1.2.101	quod licet et minimis, domui si favimus illi,
urn:cts:latinLit:phi0959.phi008:1.2.102	si satis Augusti publica iussa mihi,
urn:cts:latinLit:phi0959.phi008:1.2.103	hoc duce si dixi felicia saecula, proque
urn:cts:latinLit:phi0959.phi008:1.2.104	Caesare tura piis Caesaribusque dedi, -
urn:cts:latinLit:phi0959.phi008:1.2.105	si fuit hic animus nobis, ita parcite divi!
urn:cts:latinLit:phi0959.phi008:1.2.106	si minus, alta cadens obruat unda caput!
urn:cts:latinLit:phi0959.phi008:1.2.107	fallor, an incipiunt gravidae vanescere nubes,
urn:cts:latinLit:phi0959.phi008:1.2.108	victaque mutati frangitur unda maris?
urn:cts:latinLit:phi0959.phi008:1.2.109	non casu, vos sed sub condicione vocati,
urn:cts:latinLit:phi0959.phi008:1.2.110	fallere quos non est, hanc mihi fertis opem.

urn:cts:latinLit:phi0959.phi008:1.3.1	Cum subit illius tristissima noctis imago,
urn:cts:latinLit:phi0959.phi008:1.3.2	qua mihi supremum tempus in urbe fuit,
urn:cts:latinLit:phi0959.phi008:1.3.3	cum repeto noctem, qua tot mihi cara reliqui,
urn:cts:latinLit:phi0959.phi008:1.3.4	labitur ex oculis nunc quoque gutta meis.
urn:cts:latinLit:phi0959.phi008:1.3.5	iam prope lux aderat, qua  me discedere Caesar
urn:cts:latinLit:phi0959.phi008:1.3.6	finibus extremae iusserat Ausoniae,
urn:cts:latinLit:phi0959.phi008:1.3.7	nec spatium nec mens fuerat satis apta parandi:
urn:cts:latinLit:phi0959.phi008:1.3.8	torpuerant longa pectora nostra mora.
urn:cts:latinLit:phi0959.phi008:1.3.9	non mihi servorum, comites non cura legendi,
urn:cts:latinLit:phi0959.phi008:1.3.10	non aptae profugo vestis opisve fuit.
urn:cts:latinLit:phi0959.phi008:1.3.11	non apter stupui, quam qui Iovis ignibus ictus
urn:cts:latinLit:phi0959.phi008:1.3.12	vivit et est vitae nescius ipse suae.
urn:cts:latinLit:phi0959.phi008:1.3.13	ut tamen hanc animi nubem dolor ipse removit,
urn:cts:latinLit:phi0959.phi008:1.3.14	et tandem sensus convaluere mei,
urn:cts:latinLit:phi0959.phi008:1.3.15	adloquor extremum maestos abiturus amicos,
urn:cts:latinLit:phi0959.phi008:1.3.16	qui modo de multis unus et alter erant,
urn:cts:latinLit:phi0959.phi008:1.3.17	uxor amans flentem flens acrius ipsa tenebat,
urn:cts:latinLit:phi0959.phi008:1.3.18	imbre per indignas usque cadente genas,
urn:cts:latinLit:phi0959.phi008:1.3.19	nata procul Libycis aberat diversa sub oris,
urn:cts:latinLit:phi0959.phi008:1.3.20	nec poterat fati certior esse mei.
urn:cts:latinLit:phi0959.phi008:1.3.21	quocumque aspiceres, luctus gemitusque sonabant,
urn:cts:latinLit:phi0959.phi008:1.3.22	formaque non taciti funeris intus erat.
urn:cts:latinLit:phi0959.phi008:1.3.23	femina virque meo, pueri quoque funere maerent,
urn:cts:latinLit:phi0959.phi008:1.3.24	inque domo lacrimas angulus omnis habet.
urn:cts:latinLit:phi0959.phi008:1.3.25	si licet exemplis in parvis  grandibus uti,
urn:cts:latinLit:phi0959.phi008:1.3.26	haec facies Troiae, cum caperetur, erat.
urn:cts:latinLit:phi0959.phi008:1.3.27	iamque quiescebant voces hominumque canumque,
urn:cts:latinLit:phi0959.phi008:1.3.28	Lunaque nocturnos alta regebat equos.
urn:cts:latinLit:phi0959.phi008:1.3.29	hanc ego suspiciens et ad hanc  Capitolia cernens,
urn:cts:latinLit:phi0959.phi008:1.3.30	quae nostro frustra iuncta fuere Lari,
urn:cts:latinLit:phi0959.phi008:1.3.31	"numina vicinis habitantia sedibus," inquam,
urn:cts:latinLit:phi0959.phi008:1.3.32	"iamque oculis numquam templa videnda meis,
urn:cts:latinLit:phi0959.phi008:1.3.33	dique relinquendi, quos urbs habet alta Quirini,
urn:cts:latinLit:phi0959.phi008:1.3.34	este salutati tempus in omne mihi.
urn:cts:latinLit:phi0959.phi008:1.3.35	et quamquam sero clipeum post vulnera sumo,
urn:cts:latinLit:phi0959.phi008:1.3.36	attamen hanc odiis exonerate fugam,
urn:cts:latinLit:phi0959.phi008:1.3.37	caelestique viro, quis me deceperit error,
urn:cts:latinLit:phi0959.phi008:1.3.38	dicite, pro culpa ne scelus esse putet,
urn:cts:latinLit:phi0959.phi008:1.3.39	ut quod vos scitis, poenae quoque sentiat auctor.
urn:cts:latinLit:phi0959.phi008:1.3.40	placato possum non miser esse deo."
urn:cts:latinLit:phi0959.phi008:1.3.41	hac prece adoravi superos ego, pluribus uxor,
urn:cts:latinLit:phi0959.phi008:1.3.42	singultu medios impediente sonos,
urn:cts:latinLit:phi0959.phi008:1.3.43	illa etiam ante Lares  passis adstrata capillis
urn:cts:latinLit:phi0959.phi008:1.3.44	contigit extinctos  ore tremente focos,
urn:cts:latinLit:phi0959.phi008:1.3.45	 multaque in adversos effudit verba Penates
urn:cts:latinLit:phi0959.phi008:1.3.46	pro deplorato non valitura viro.
urn:cts:latinLit:phi0959.phi008:1.3.47	iamque morae spatium nox praecipitata negabat,
urn:cts:latinLit:phi0959.phi008:1.3.48	versaque ab axe suo Parrhasis Arctos erat.
urn:cts:latinLit:phi0959.phi008:1.3.49	quid facerem? blando patriae retinebar amore,
urn:cts:latinLit:phi0959.phi008:1.3.50	ultima sed iussae nox erat illa fugae.
urn:cts:latinLit:phi0959.phi008:1.3.51	a! quotiens aliquo dixi properante quid urgues?
urn:cts:latinLit:phi0959.phi008:1.3.52	vel quo festinas ire, vel unde, vide.
urn:cts:latinLit:phi0959.phi008:1.3.53	a! quotiens certam me sum mentitus habere
urn:cts:latinLit:phi0959.phi008:1.3.54	horam, propositae quae foret apta viae.
urn:cts:latinLit:phi0959.phi008:1.3.55	ter limen tetigi, ter sum revocatus, et ipse
urn:cts:latinLit:phi0959.phi008:1.3.56	indulgens animo pes mihi tardus erat.
urn:cts:latinLit:phi0959.phi008:1.3.57	saepe "vale" dicto rursus sum multa locutus,
urn:cts:latinLit:phi0959.phi008:1.3.58	et quasi discedens oscula summa dedi.
urn:cts:latinLit:phi0959.phi008:1.3.59	saepe eadem mandata dedi meque ipse fefelli,
urn:cts:latinLit:phi0959.phi008:1.3.60	respiciens oculis pignora cara meis.
urn:cts:latinLit:phi0959.phi008:1.3.61	denique "quid propero? Scythia est, quo mittimur," inquam,
urn:cts:latinLit:phi0959.phi008:1.3.62	"Roma relinquenda est. utraque iusta mora est.
urn:cts:latinLit:phi0959.phi008:1.3.63	uxor in aeternum vivo mihi viva negatur,
urn:cts:latinLit:phi0959.phi008:1.3.64	et domus et fidae dulcia membra domus,
urn:cts:latinLit:phi0959.phi008:1.3.65	quosque ego dilexi fraterno more sodales,
urn:cts:latinLit:phi0959.phi008:1.3.66	o mihi Thesea pectora iuncta fide!
urn:cts:latinLit:phi0959.phi008:1.3.67	dum licet, amplectar: numquam fortasse licebit
urn:cts:latinLit:phi0959.phi008:1.3.68	amplius, in lucro est quae datur hora mihi.
urn:cts:latinLit:phi0959.phi008:1.3.69	nec mora, sermonis verba inperfecta relinquo,
urn:cts:latinLit:phi0959.phi008:1.3.70	complectens animo proxima quaeque meo.
urn:cts:latinLit:phi0959.phi008:1.3.71	dum loquor et flemus, caelo nitidissimus alto,
urn:cts:latinLit:phi0959.phi008:1.3.72	stella gravis nobis. Lucifer ortus erat.
urn:cts:latinLit:phi0959.phi008:1.3.73	dividor haud aliter, quam si mea membra relinquam,
urn:cts:latinLit:phi0959.phi008:1.3.74	et pars abrumpi corpore visa suo est.
urn:cts:latinLit:phi0959.phi008:1.3.75	sic doluit Mettus  tunc cum in contraria versos
urn:cts:latinLit:phi0959.phi008:1.3.76	ultores habuit proditionis equos.
urn:cts:latinLit:phi0959.phi008:1.3.77	tum vero exoritur clamor gemitusque meorum,
urn:cts:latinLit:phi0959.phi008:1.3.78	et feriunt maestae pectora nuda manus.
urn:cts:latinLit:phi0959.phi008:1.3.79	tum vero coniunx umeris abeuntis inhaerens
urn:cts:latinLit:phi0959.phi008:1.3.80	miscuit haec lacrimis tristia verba meis;
