urn:cts:latinLit:phi0959.phi008:3.11.17	ut mala nulla feram nisi nudam Caesaris iram,
urn:cts:latinLit:phi0959.phi008:3.11.18	nuda parum nobis Caesaris ira mali est?
urn:cts:latinLit:phi0959.phi008:3.11.19	et tamen est aliquis, qui vulnera cruda retractet,
urn:cts:latinLit:phi0959.phi008:3.11.20	solvat et in mores ora diserta meos.
urn:cts:latinLit:phi0959.phi008:3.11.21	in causa facili cuivis licet esse diserto,
urn:cts:latinLit:phi0959.phi008:3.11.22	et minimae vires frangere quassa valent,
urn:cts:latinLit:phi0959.phi008:3.11.23	subruere est arces et stantia moenia virtus:
urn:cts:latinLit:phi0959.phi008:3.11.24	quamlibet ignavi praecipitata premunt.
urn:cts:latinLit:phi0959.phi008:3.11.25	non sum ego quod  fueram, quid inanem proteris umbram
urn:cts:latinLit:phi0959.phi008:3.11.26	quid cinerem saxis bustaque nostra petis?
urn:cts:latinLit:phi0959.phi008:3.11.27	Hector erat tunc cum bello certabat; at idem
urn:cts:latinLit:phi0959.phi008:3.11.28	vinctus ad Haemonios non erat Hector equos,
urn:cts:latinLit:phi0959.phi008:3.11.29	me quoque, quem noras olim, non esse memento:
urn:cts:latinLit:phi0959.phi008:3.11.30	ex illo superant haec simulacra viro.
urn:cts:latinLit:phi0959.phi008:3.11.31	quid simulacra, ferox, dictis incessis amans?
urn:cts:latinLit:phi0959.phi008:3.11.32	parce, precor, Manes sollicitare meos!
urn:cts:latinLit:phi0959.phi008:3.11.33	omnia vera puta mea crimina, nil sit in illis,
urn:cts:latinLit:phi0959.phi008:3.11.34	quod magis errorem quam scelus esse putes,
urn:cts:latinLit:phi0959.phi008:3.11.35	pendimus en profugi -  - satia tua pectora poenas
urn:cts:latinLit:phi0959.phi008:3.11.36	exilioque graves exiliique loco.
urn:cts:latinLit:phi0959.phi008:3.11.37	carnifici fortuna potest mea flenda videri:
urn:cts:latinLit:phi0959.phi008:3.11.38	et tamen est uno iudice mersa parum.
urn:cts:latinLit:phi0959.phi008:3.11.39	saevior es tristi Busiride, saevior illo,
urn:cts:latinLit:phi0959.phi008:3.11.40	qui falsum lento terruit igne bovem,
urn:cts:latinLit:phi0959.phi008:3.11.41	quique bovem Siculo fertur donasse tyranno,
urn:cts:latinLit:phi0959.phi008:3.11.42	et dictis artes conciliasse suas '.
urn:cts:latinLit:phi0959.phi008:3.11.43	munere in hoc, rex, est usus, sed imagine maior,
urn:cts:latinLit:phi0959.phi008:3.11.44	nec sola est operis forma probanda mei.
urn:cts:latinLit:phi0959.phi008:3.11.45	aspicis a dextra latus hoc adapertile tauri?
urn:cts:latinLit:phi0959.phi008:3.11.46	hac  tibi, quem perdes, coniciendus erit.
urn:cts:latinLit:phi0959.phi008:3.11.47	protinus inclusum lentis carbonibus ure:
urn:cts:latinLit:phi0959.phi008:3.11.48	mugiet, et veri vox erit illa bovis.
urn:cts:latinLit:phi0959.phi008:3.11.49	pro quibus inventis, ut munus munere penses,
urn:cts:latinLit:phi0959.phi008:3.11.50	da, precor, ingenio praemia digna meo.
urn:cts:latinLit:phi0959.phi008:3.11.51	dixerat, at Phalaris " poenae mirande repertor,
urn:cts:latinLit:phi0959.phi008:3.11.52	ipse tuum praesens imbue " dixit " opus."
urn:cts:latinLit:phi0959.phi008:3.11.53	'nec mora, monstratis crudeliter ignibus ustus
urn:cts:latinLit:phi0959.phi008:3.11.54	exhibuit geminos ore gemente sonos.
urn:cts:latinLit:phi0959.phi008:3.11.55	quid mihi cum Siculis inter Scythiamque Getasque?
urn:cts:latinLit:phi0959.phi008:3.11.56	ad te, quisquis is es, nostra querella redit,
urn:cts:latinLit:phi0959.phi008:3.11.57	utque sitim nostro possis explere cruore,
urn:cts:latinLit:phi0959.phi008:3.11.58	quantaque vis, avido gaudia corde feras,
urn:cts:latinLit:phi0959.phi008:3.11.59	tot mala sum fugiens tellure, tot aequore passus,
urn:cts:latinLit:phi0959.phi008:3.11.60	te quoque ut auditis posse dolere putem,
urn:cts:latinLit:phi0959.phi008:3.11.61	crede mihi, si sit nobis collatus Ulixes,
urn:cts:latinLit:phi0959.phi008:3.11.62	Neptuni  minor est quam Iovis ira fuit.
urn:cts:latinLit:phi0959.phi008:3.11.63	ergo quicumque es, rescindere crimina noli,
urn:cts:latinLit:phi0959.phi008:3.11.64	deque gravi duras vulnere tolle manus;
urn:cts:latinLit:phi0959.phi008:3.11.65	utque meae famam tenuent oblivia culpae,
urn:cts:latinLit:phi0959.phi008:3.11.66	facta cicatricem ducere nostra sine;
urn:cts:latinLit:phi0959.phi008:3.11.67	humanaeque memor sortis, quae tollit eosdem
urn:cts:latinLit:phi0959.phi008:3.11.68	et premit, incertas ipse verere vices.
urn:cts:latinLit:phi0959.phi008:3.11.69	et quoniam, fieri quod numquam posse putavi,
urn:cts:latinLit:phi0959.phi008:3.11.70	est tibi de rebus maxima cura meis,
urn:cts:latinLit:phi0959.phi008:3.11.71	non est quod timeas . fortuna miserrima nostra est,
urn:cts:latinLit:phi0959.phi008:3.11.72	omne trahit secum Caesaris ira malum.
urn:cts:latinLit:phi0959.phi008:3.11.73	quod magis ut liqueat, neve hoc ego fingere credar,
urn:cts:latinLit:phi0959.phi008:3.11.74	ipse velim poenas experiare meas.

urn:cts:latinLit:phi0959.phi008:3.12.1	Frigora iam Zephyri minuunt, annoque peracto
urn:cts:latinLit:phi0959.phi008:3.12.2	longior antiquis visa Maeotis hiems,
urn:cts:latinLit:phi0959.phi008:3.12.3	inpositamque sibi qui non bene pertulit Hellen,
urn:cts:latinLit:phi0959.phi008:3.12.4	tempora nocturnis aequa diurna facit,
urn:cts:latinLit:phi0959.phi008:3.12.5	iam violam puerique legunt hilaresque puellae,
urn:cts:latinLit:phi0959.phi008:3.12.6	rustica quae nullo nata serente venit;
urn:cts:latinLit:phi0959.phi008:3.12.7	prataque pubescunt variorum flore colorum,
urn:cts:latinLit:phi0959.phi008:3.12.8	indocilique loquax gutture vernat avis;
urn:cts:latinLit:phi0959.phi008:3.12.9	utque malae matris crimen deponat hirundo
urn:cts:latinLit:phi0959.phi008:3.12.10	sub trabibus cunas tectaque parva facit :
urn:cts:latinLit:phi0959.phi008:3.12.11	herbaque, quae latuit Cerealibus obruta sulcis,
urn:cts:latinLit:phi0959.phi008:3.12.12	exit et expandit molle cacumen humo;
urn:cts:latinLit:phi0959.phi008:3.12.13	quoque loco est vitis, de palmite gemma movetur:
urn:cts:latinLit:phi0959.phi008:3.12.14	nam procul a Getico litore vitis abest;
urn:cts:latinLit:phi0959.phi008:3.12.15	quoque loco est arbor, turgescit in arbore ramus:
urn:cts:latinLit:phi0959.phi008:3.12.16	nam procul a Getieis finibus arbor abest,
urn:cts:latinLit:phi0959.phi008:3.12.17	otia nunc istic, iunctisque ex ordine ludis
urn:cts:latinLit:phi0959.phi008:3.12.18	cedunt verbosi garrula bella fori. lusus
urn:cts:latinLit:phi0959.phi008:3.12.19	usus equi nunc est, levibus nunc luditur armis,
urn:cts:latinLit:phi0959.phi008:3.12.20	nunc pila, nunc celeri volvitur orbe trochus;
urn:cts:latinLit:phi0959.phi008:3.12.21	nunc ubi perfusa est oleo labente iuventus,
urn:cts:latinLit:phi0959.phi008:3.12.22	defessos artus Virgine tinguit aqua.
urn:cts:latinLit:phi0959.phi008:3.12.23	scaena viget studiisque favor distantibus ardet,
urn:cts:latinLit:phi0959.phi008:3.12.24	proque tribus resonant terna theatra foris.
urn:cts:latinLit:phi0959.phi008:3.12.25	o quater, o quotiens non est numerare, beatum,
urn:cts:latinLit:phi0959.phi008:3.12.26	non interdicta cui licet urbe frui!
urn:cts:latinLit:phi0959.phi008:3.12.27	at mihi sentitur nix verno sole soluta,
urn:cts:latinLit:phi0959.phi008:3.12.28	quaeque lacu durae non fodiantur aquae .
urn:cts:latinLit:phi0959.phi008:3.12.29	nec mare concrescit glacie, nec, ut ante, per Histrum
urn:cts:latinLit:phi0959.phi008:3.12.30	stridula Sauromates plaustra bubulcus agit.
urn:cts:latinLit:phi0959.phi008:3.12.31	incipient  aliquae tamen huc adnare carinae,
urn:cts:latinLit:phi0959.phi008:3.12.32	hospitaque in Ponti litore puppis erit.
urn:cts:latinLit:phi0959.phi008:3.12.33	sedulus occurram nautae, dictaque salute,
urn:cts:latinLit:phi0959.phi008:3.12.34	quid veniat, quaeram, quisve quibusve locis.
urn:cts:latinLit:phi0959.phi008:3.12.35	ille quidem mirum ni de regione propinqua
urn:cts:latinLit:phi0959.phi008:3.12.36	non nisi vicinas tutus ararit  aquas.
urn:cts:latinLit:phi0959.phi008:3.12.37	rarus ab Italia tantum mare navita transit,
urn:cts:latinLit:phi0959.phi008:3.12.38	litora rarus in haec portubus orba venit,
urn:cts:latinLit:phi0959.phi008:3.12.39	sive tamen Graeca scierit, sive ille Latina
urn:cts:latinLit:phi0959.phi008:3.12.40	voce loqui - certe gratior huius erit;
urn:cts:latinLit:phi0959.phi008:3.12.41	fas quoque ab ore freti longaeque Propontidos undis
urn:cts:latinLit:phi0959.phi008:3.12.42	huc aliquem certo vela dedisse Noto -
urn:cts:latinLit:phi0959.phi008:3.12.43	quisquis is est, memori rumorem voce referre
urn:cts:latinLit:phi0959.phi008:3.12.44	et fieri famae parsque gradusque potest.
urn:cts:latinLit:phi0959.phi008:3.12.45	is, precor, auditos possit narrare triumphos
urn:cts:latinLit:phi0959.phi008:3.12.46	Caesaris et Latio reddita vota Iovi,
urn:cts:latinLit:phi0959.phi008:3.12.47	teque, rebellatrix, tandem, Germania, magni
urn:cts:latinLit:phi0959.phi008:3.12.48	triste caput pedibus supposuisse ducis.
urn:cts:latinLit:phi0959.phi008:3.12.49	haec mihi qui referet, quae non vidisse dolebo,
urn:cts:latinLit:phi0959.phi008:3.12.50	ille meae domui protinus hospes erit.
urn:cts:latinLit:phi0959.phi008:3.12.51	ei mihi, iamne domus Scythico Nasonis in orbe est?
urn:cts:latinLit:phi0959.phi008:3.12.52	iamque suum mihi dat pro Lare poena locum?
urn:cts:latinLit:phi0959.phi008:3.12.53	di facite ut Caesar non hic penetrale domumque,
urn:cts:latinLit:phi0959.phi008:3.12.54	hospitium poenae sed velit esse meae.

urn:cts:latinLit:phi0959.phi008:3.13.1	Ecce supervacuus - quid enim fuit utile gigni? -
urn:cts:latinLit:phi0959.phi008:3.13.2	ad sua Natalis tempora noster adest,
urn:cts:latinLit:phi0959.phi008:3.13.3	dure, quid ad miseros veniebas exulis annos?
urn:cts:latinLit:phi0959.phi008:3.13.4	debueras illis inposuisse modum.
urn:cts:latinLit:phi0959.phi008:3.13.5	si tibi cura mei, vel si pudor ullus inesset,
urn:cts:latinLit:phi0959.phi008:3.13.6	non ultra patriam me sequerere meam,
urn:cts:latinLit:phi0959.phi008:3.13.7	quoque loco primum tibi sum male cognitus infans,
urn:cts:latinLit:phi0959.phi008:3.13.8	illo temptasses ultimus esse mihi,
urn:cts:latinLit:phi0959.phi008:3.13.9	inque relinquendo, quod idem fecere sodales,
urn:cts:latinLit:phi0959.phi008:3.13.10	tu quoque dixisses tristis in urbe vale.
urn:cts:latinLit:phi0959.phi008:3.13.11	quid tibi cum Ponto? num te quoque Caesaris ira
urn:cts:latinLit:phi0959.phi008:3.13.12	extremam gelidi misit in orbis humum?
urn:cts:latinLit:phi0959.phi008:3.13.13	scilicet expectas soliti tibi moris honorem,
urn:cts:latinLit:phi0959.phi008:3.13.14	pendeat ex umeris vestis ut alba meis,
urn:cts:latinLit:phi0959.phi008:3.13.15	fumida cingatur florentibus ara coronis,
urn:cts:latinLit:phi0959.phi008:3.13.16	micaque sollemni turis in igne sonet,
urn:cts:latinLit:phi0959.phi008:3.13.17	libaque dem proprie genitale notantia tempus,
urn:cts:latinLit:phi0959.phi008:3.13.18	concipiamque bonas ore favente preces.
urn:cts:latinLit:phi0959.phi008:3.13.19	non ita sum positus, nec sunt ea tempora nobis,
urn:cts:latinLit:phi0959.phi008:3.13.20	adventu possim laetus ut esse tuo.
urn:cts:latinLit:phi0959.phi008:3.13.21	funeris ara mihi, ferali cincta cupressu,
urn:cts:latinLit:phi0959.phi008:3.13.22	convenit et structis flamma parata rogis.
urn:cts:latinLit:phi0959.phi008:3.13.23	nec dare tura libet nil exorantia divos,
urn:cts:latinLit:phi0959.phi008:3.13.24	in tantis subeunt nec bona verba malis.
urn:cts:latinLit:phi0959.phi008:3.13.25	si tamen est aliquid nobis hac luce petendum,
urn:cts:latinLit:phi0959.phi008:3.13.26	in loca ne redeas amplius ista, precor,
urn:cts:latinLit:phi0959.phi008:3.13.27	dum me terrarum pars paene novissima. Pontus,
urn:cts:latinLit:phi0959.phi008:3.13.28	Euxinus falso nomine dictus, habet.

urn:cts:latinLit:phi0959.phi008:3.14.1	Cultor et antistes doctorum sancte virorum,
urn:cts:latinLit:phi0959.phi008:3.14.2	quid facis, ingenio semper amice meo?
urn:cts:latinLit:phi0959.phi008:3.14.3	ecquid, ut incolumem quondam celebrare solebas,
urn:cts:latinLit:phi0959.phi008:3.14.4	nunc quoque, ne videar totus abesse, caves?
urn:cts:latinLit:phi0959.phi008:3.14.5	 suscipis  exceptis ecquid mea carmina solis
urn:cts:latinLit:phi0959.phi008:3.14.6	Artibus, artifici quae nocuere suo?
urn:cts:latinLit:phi0959.phi008:3.14.7	immo ita fac, quaeso, vatum studiose novorum,
urn:cts:latinLit:phi0959.phi008:3.14.8	quaque potes, retine corpus in urbe meum.
urn:cts:latinLit:phi0959.phi008:3.14.9	est fuga dicta mihi, non est fuga dicta libellis,
urn:cts:latinLit:phi0959.phi008:3.14.10	qui domini poenam non meruere sui.
urn:cts:latinLit:phi0959.phi008:3.14.11	saepe per externas  profugus pater exulat oras,
urn:cts:latinLit:phi0959.phi008:3.14.12	urbe tamen natis exulis esse licet.
urn:cts:latinLit:phi0959.phi008:3.14.13	Palladis exemplo de me sine matre creata
urn:cts:latinLit:phi0959.phi008:3.14.14	carmina sunt; stirps haec progeniesque mea est.
urn:cts:latinLit:phi0959.phi008:3.14.15	hanc tibi commendo, quae quo magis orba parente est,
urn:cts:latinLit:phi0959.phi008:3.14.16	hoc tibi tutori sarcina maior erit.
urn:cts:latinLit:phi0959.phi008:3.14.17	tres mihi sunt nati contagia nostra secuti:
urn:cts:latinLit:phi0959.phi008:3.14.18	cetera fac curae sit tibi turba palam.
urn:cts:latinLit:phi0959.phi008:3.14.19	sunt quoque mutatae, ter quinque volumina, formae,
urn:cts:latinLit:phi0959.phi008:3.14.20	carmina de domini funere rapta sui.
urn:cts:latinLit:phi0959.phi008:3.14.21	illud opus potuit, si non prius ipse perissem,
urn:cts:latinLit:phi0959.phi008:3.14.22	certius a summa nomen habere manu:
urn:cts:latinLit:phi0959.phi008:3.14.23	nunc incorrectum populi pervenit in ora,
urn:cts:latinLit:phi0959.phi008:3.14.24	in populi quicquam si tamen ore mei est.
urn:cts:latinLit:phi0959.phi008:3.14.25	hoc quoque nescio quid nostris appone libellis,
urn:cts:latinLit:phi0959.phi008:3.14.26	diverso missum quod tibi ab orbe venit.
urn:cts:latinLit:phi0959.phi008:3.14.27	quod quicumque leget, si quis leget aestimet ante,
urn:cts:latinLit:phi0959.phi008:3.14.28	compositum quo sit tempore quoque loco.
urn:cts:latinLit:phi0959.phi008:3.14.29	aequus erit scriptis, quorum cognoverit esse
urn:cts:latinLit:phi0959.phi008:3.14.30	exilium tempus barbariamque locum:
urn:cts:latinLit:phi0959.phi008:3.14.31	inque tot adversis carmen mirabitur ullum
urn:cts:latinLit:phi0959.phi008:3.14.32	ducere me tristi sustinuisse manu.
urn:cts:latinLit:phi0959.phi008:3.14.33	ingenium fregere meum mala, cuius et ante
urn:cts:latinLit:phi0959.phi008:3.14.34	fons infecundus parvaque vena fuit.
urn:cts:latinLit:phi0959.phi008:3.14.35	sed quaecumque fuit, nullo exercente refugit,
urn:cts:latinLit:phi0959.phi008:3.14.36	et longo periit arida facta situ.
urn:cts:latinLit:phi0959.phi008:3.14.37	non hic librorum, per quos inviter alarque,
urn:cts:latinLit:phi0959.phi008:3.14.38	copia . pro libris arcus et arma sonant,
urn:cts:latinLit:phi0959.phi008:3.14.39	nullus in hac terra, recitem si carmina, cuius
urn:cts:latinLit:phi0959.phi008:3.14.40	intellecturis auribus utar, adest;
urn:cts:latinLit:phi0959.phi008:3.14.41	non quo secedam locus est. custodia muri
urn:cts:latinLit:phi0959.phi008:3.14.42	summovet infestos clausaque porta Getas.
urn:cts:latinLit:phi0959.phi008:3.14.43	saepe aliquod quaero verbum nomenque locumque,
urn:cts:latinLit:phi0959.phi008:3.14.44	nec quisquam est a quo certior esse queam.
urn:cts:latinLit:phi0959.phi008:3.14.45	dicere saepe aliquid conanti - turpe fateri! -
urn:cts:latinLit:phi0959.phi008:3.14.46	verba mihi desunt dedidicique loqui.
urn:cts:latinLit:phi0959.phi008:3.14.47	Threicio Scythicoque fere  circumsonor ore,
urn:cts:latinLit:phi0959.phi008:3.14.48	et videor Geticis scribere posse modis,
urn:cts:latinLit:phi0959.phi008:3.14.49	crede mihi, timeo ne sint inmixta Latinis
urn:cts:latinLit:phi0959.phi008:3.14.50	inque meis scriptis Pontica verba legas,
urn:cts:latinLit:phi0959.phi008:3.14.51	qualemcumque igitur venia dignare libellum,
urn:cts:latinLit:phi0959.phi008:3.14.52	sortis et excusa condicione meae.

urn:cts:latinLit:phi0959.phi008:4.1.1	Siqua meis fuerint, ut erunt, vitiosa libellis,
urn:cts:latinLit:phi0959.phi008:4.1.2	excusata suo tempore, lector, habe.
urn:cts:latinLit:phi0959.phi008:4.1.3	exul eram, requiesque mihi, non fama petita est,
urn:cts:latinLit:phi0959.phi008:4.1.4	mens intenta suis ne foret usque malis.
urn:cts:latinLit:phi0959.phi008:4.1.5	hoc est cur cantet vinctus quoque compede fossor,
urn:cts:latinLit:phi0959.phi008:4.1.6	indocili numero cum grave mollit opus.
urn:cts:latinLit:phi0959.phi008:4.1.7	cantat et innitens limosae pronus harenae,
urn:cts:latinLit:phi0959.phi008:4.1.8	adverso tardam qui trahit amne ratem;
urn:cts:latinLit:phi0959.phi008:4.1.9	quique refert pariter lentos ad pectora remos,
urn:cts:latinLit:phi0959.phi008:4.1.10	in numerum pulsa brachia pulsat  aqua.
urn:cts:latinLit:phi0959.phi008:4.1.11	fessus ubi incubuit baculo saxove resedit
urn:cts:latinLit:phi0959.phi008:4.1.12	pastor, harundineo carmine mulcet oves.
urn:cts:latinLit:phi0959.phi008:4.1.13	cantantis pariter, pariter data pensa trahentis,
urn:cts:latinLit:phi0959.phi008:4.1.14	fallitur ancillae decipiturque labor.
urn:cts:latinLit:phi0959.phi008:4.1.15	fertur et abducta Lyrneside tristis Achilles
urn:cts:latinLit:phi0959.phi008:4.1.16	Haemonia curas attenuasse lyra.
urn:cts:latinLit:phi0959.phi008:4.1.17	cum traheret silvas Orpheus et dura canendo
urn:cts:latinLit:phi0959.phi008:4.1.18	saxa, bis amissa coniuge maestus erat.
urn:cts:latinLit:phi0959.phi008:4.1.19	me quoque Musa levat Ponti loca iussa petentem.
urn:cts:latinLit:phi0959.phi008:4.1.20	sola comes nostrae perstitit illa fugae;
urn:cts:latinLit:phi0959.phi008:4.1.21	sola nec insidias, Sinti nec  militis ensem,
urn:cts:latinLit:phi0959.phi008:4.1.22	nec mare nec ventos barbariamque timet.
urn:cts:latinLit:phi0959.phi008:4.1.23	scit quoque, cum perii, quis me deceperit error,
urn:cts:latinLit:phi0959.phi008:4.1.24	et culpam in facto, non scelus, esse meo,
urn:cts:latinLit:phi0959.phi008:4.1.25	scilicet hoc ipso nunc aequa, quod obfuit ante,
urn:cts:latinLit:phi0959.phi008:4.1.26	cum mecum iuncti criminis acta rea est.
urn:cts:latinLit:phi0959.phi008:4.1.27	non equidem vellem, quoniam nocitura fuerunt,
urn:cts:latinLit:phi0959.phi008:4.1.28	Pieridum sacris inposuisse manum,
urn:cts:latinLit:phi0959.phi008:4.1.29	sed nunc quid faciam? vis me tenet ipsa sacrorum,
urn:cts:latinLit:phi0959.phi008:4.1.30	et carmen demens carmine laesus amo.
urn:cts:latinLit:phi0959.phi008:4.1.31	sic nova Dulichio lotos gustata palato
urn:cts:latinLit:phi0959.phi008:4.1.32	illo, quo nocuit, grata sapore fuit.
urn:cts:latinLit:phi0959.phi008:4.1.33	sentit amans sua damna fere, tamen haeret in illis,
urn:cts:latinLit:phi0959.phi008:4.1.34	materiam culpae persequiturque suae.
urn:cts:latinLit:phi0959.phi008:4.1.35	nos quoque delectant, quamvis nocuere, libelli,
urn:cts:latinLit:phi0959.phi008:4.1.36	quodque mihi telum vulnera fecit, amo.
urn:cts:latinLit:phi0959.phi008:4.1.37	forsitan hoc studium possit furor esse videri,
urn:cts:latinLit:phi0959.phi008:4.1.38	sed quiddam furor hic utilitatis habet,
urn:cts:latinLit:phi0959.phi008:4.1.39	semper in obtutu mentem vetat esse malorum,
urn:cts:latinLit:phi0959.phi008:4.1.40	 praesentis casus inmemoremque facit,
urn:cts:latinLit:phi0959.phi008:4.1.41	utque suum Bacche non sentit saucia vulnus,
urn:cts:latinLit:phi0959.phi008:4.1.42	dum stupet Idaeis exululata modis,
urn:cts:latinLit:phi0959.phi008:4.1.43	sic ubi mota calent viridi mea pectora thyrso,
urn:cts:latinLit:phi0959.phi008:4.1.44	altior humano spiritus ille malo est.
urn:cts:latinLit:phi0959.phi008:4.1.45	ille nec exilium, Scythici nec litora ponti,
urn:cts:latinLit:phi0959.phi008:4.1.46	ille nec iratos sentit habere deos.
urn:cts:latinLit:phi0959.phi008:4.1.47	utque soporiferae biberem si pocula Lethes,
urn:cts:latinLit:phi0959.phi008:4.1.48	temporis adversi sic mihi sensus abest.
urn:cts:latinLit:phi0959.phi008:4.1.49	iure deas igitur veneror mala nostra levantes,
urn:cts:latinLit:phi0959.phi008:4.1.50	sollicitae  comites ex Helicone fugae,
urn:cts:latinLit:phi0959.phi008:4.1.51	et partim pelago partim vestigia terra
urn:cts:latinLit:phi0959.phi008:4.1.52	vel rate dignatas vel pede nostra sequi,
urn:cts:latinLit:phi0959.phi008:4.1.53	sint, precor, haec saltem faciles mihi! namque deorum
urn:cts:latinLit:phi0959.phi008:4.1.54	cetera cum magno Caesare turba facit,
urn:cts:latinLit:phi0959.phi008:4.1.55	meque tot adversis cumulant, quot litus harenas,
urn:cts:latinLit:phi0959.phi008:4.1.56	quotque fretum pisces, ovaque piscis habet,
urn:cts:latinLit:phi0959.phi008:4.1.57	vere prius flores, aestu numerabis aristas,
urn:cts:latinLit:phi0959.phi008:4.1.58	poma per autumnum frigoribusque nives,
urn:cts:latinLit:phi0959.phi008:4.1.59	quam mala, quae toto patior iactatus in orbe,
urn:cts:latinLit:phi0959.phi008:4.1.60	dum miser Euxini litora laeva  peto.
urn:cts:latinLit:phi0959.phi008:4.1.61	nec tamen, ut veni, levior fortuna malorum est :
urn:cts:latinLit:phi0959.phi008:4.1.62	huc quoque sunt nostras fata secuta vias.
urn:cts:latinLit:phi0959.phi008:4.1.63	hic quoque cognosco natalis stamina nostri,
urn:cts:latinLit:phi0959.phi008:4.1.64	stamina de nigro vellere facta mihi.
urn:cts:latinLit:phi0959.phi008:4.1.65	utque neque insidias capitisque pericula narrem,
urn:cts:latinLit:phi0959.phi008:4.1.66	vera quidem, veri  sed graviora fide,
urn:cts:latinLit:phi0959.phi008:4.1.67	vivere quam miserum est inter Bessosque Getasque
urn:cts:latinLit:phi0959.phi008:4.1.68	illum, qui populi semper in ore ruit .
urn:cts:latinLit:phi0959.phi008:4.1.69	quam miserum est, porta vitam muroque tueri,
urn:cts:latinLit:phi0959.phi008:4.1.70	vixque sui tutum viribus esse loci!
urn:cts:latinLit:phi0959.phi008:4.1.71	aspera militiae iuvenis certamina fugi,
urn:cts:latinLit:phi0959.phi008:4.1.72	nec nisi lusura movimus arma manu;
urn:cts:latinLit:phi0959.phi008:4.1.73	nunc senior gladioque latus scutoque sinistram,
urn:cts:latinLit:phi0959.phi008:4.1.74	canitiem galeae subicioque meam.
urn:cts:latinLit:phi0959.phi008:4.1.75	nam dedit e specula custos ubi signa tumultus,
urn:cts:latinLit:phi0959.phi008:4.1.76	induimus trepida protinus arma manu.
urn:cts:latinLit:phi0959.phi008:4.1.77	hostis, habens arcus imbutaque tela venenis,
urn:cts:latinLit:phi0959.phi008:4.1.78	saevus anhelanti moenia lustrat equo,
urn:cts:latinLit:phi0959.phi008:4.1.79	utque rapax pecudem, quae se non texit ovili,
urn:cts:latinLit:phi0959.phi008:4.1.80	per sata, per silvas fertque trahitque lupus,
urn:cts:latinLit:phi0959.phi008:4.1.81	sic, siquem nondum portarum saepe  receptum
urn:cts:latinLit:phi0959.phi008:4.1.82	barbarus in campis repperit hostis, habet:
urn:cts:latinLit:phi0959.phi008:4.1.83	aut sequitur captus coniectaque vincula collo
urn:cts:latinLit:phi0959.phi008:4.1.84	accipit, aut telo virus habente perit.
urn:cts:latinLit:phi0959.phi008:4.1.85	hic ego sollicitae lateo novus incola sedis .
urn:cts:latinLit:phi0959.phi008:4.1.86	heu nimium fati tempora longa  mei!
urn:cts:latinLit:phi0959.phi008:4.1.87	et tamen ad numeros antiquaque sacra reverti
urn:cts:latinLit:phi0959.phi008:4.1.88	sustinet in tantis hospita Musa malis,
urn:cts:latinLit:phi0959.phi008:4.1.89	sed neque cui recitem quisquam est mea carmina, nec qui
urn:cts:latinLit:phi0959.phi008:4.1.90	auribus accipiat verba Latina suis.
urn:cts:latinLit:phi0959.phi008:4.1.91	ipse mihi - quid enim faciam? - scriboque legoque,
urn:cts:latinLit:phi0959.phi008:4.1.92	tutaque iudicio littera nostra suo est.
urn:cts:latinLit:phi0959.phi008:4.1.93	saepe tamen dixi cui nunc haec cura laborat?
urn:cts:latinLit:phi0959.phi008:4.1.94	an mea Sauromatae scripta Getaeque legent?
urn:cts:latinLit:phi0959.phi008:4.1.95	saepe etiam lacrimae me sunt scribente profusae,
urn:cts:latinLit:phi0959.phi008:4.1.96	umidaque est fletu littera facta meo,
urn:cts:latinLit:phi0959.phi008:4.1.97	corque vetusta meum, tamquam nova, vulnera novit,
urn:cts:latinLit:phi0959.phi008:4.1.98	inque sinum maestae labitur imber aquae,
urn:cts:latinLit:phi0959.phi008:4.1.99	cum vice mutata, qui sim fuerimque, recordor,
urn:cts:latinLit:phi0959.phi008:4.1.100	et, tulerit quo me casus et unde, subit,
urn:cts:latinLit:phi0959.phi008:4.1.101	saepe manus demens, studiis irata sibique,
urn:cts:latinLit:phi0959.phi008:4.1.102	misit in arsuros carmina nostra focos,
urn:cts:latinLit:phi0959.phi008:4.1.103	atque ita  de multis quoniam non multa supersunt,
urn:cts:latinLit:phi0959.phi008:4.1.104	cum venia facito, quisquis es, ista legas.
urn:cts:latinLit:phi0959.phi008:4.1.105	tu quoque non melius, quam sunt mea tempora, carmen,
urn:cts:latinLit:phi0959.phi008:4.1.106	interdicta mihi, consule. Roma, boni.

urn:cts:latinLit:phi0959.phi008:4.2.1	Iam fera Caesaribus Germania, totus ut orbis,
urn:cts:latinLit:phi0959.phi008:4.2.2	victa potest flexo succubuisse genu,
urn:cts:latinLit:phi0959.phi008:4.2.3	altaque velentur fortasse Palatia sertis,
urn:cts:latinLit:phi0959.phi008:4.2.4	turaque in igne sonent inficiantque diem,
urn:cts:latinLit:phi0959.phi008:4.2.5	candidaque adducta collum percussa securi
urn:cts:latinLit:phi0959.phi008:4.2.6	victima purpureo sanguine pulset humum,
urn:cts:latinLit:phi0959.phi008:4.2.7	donaque amicorum templis promissa deorum
urn:cts:latinLit:phi0959.phi008:4.2.8	reddere victores Caesar uterque parent,
urn:cts:latinLit:phi0959.phi008:4.2.9	et qui Caesareo iuvenes sub nomine crescunt,
urn:cts:latinLit:phi0959.phi008:4.2.10	perpetuo terras ut domus illa regat,
urn:cts:latinLit:phi0959.phi008:4.2.11	cumque bonis nuribus pro sospite Livia nato
urn:cts:latinLit:phi0959.phi008:4.2.12	munera det meritis, saepe datura, deis,
urn:cts:latinLit:phi0959.phi008:4.2.13	et pariter matres et quae sine crimine castos
urn:cts:latinLit:phi0959.phi008:4.2.14	perpetua servant virginitate focos;
urn:cts:latinLit:phi0959.phi008:4.2.15	plebs pia cumque pia laetetur plebe senatus,
urn:cts:latinLit:phi0959.phi008:4.2.16	parvaque cuius eram pars ego nuper eques.
urn:cts:latinLit:phi0959.phi008:4.2.17	nos procul expulsos communia gaudia fallunt,
urn:cts:latinLit:phi0959.phi008:4.2.18	famaque tam longe non nisi parva venit,
